company_name,category,description,overall_rating,review_count,clients,notable_project,industries,location,company_size,min_project_size
Avivi,blockchain,"Avivi is an outsourcing company based in Kiev, Ukraine, with offices in Moscow and Calgary, Canada. Founded in 2007, their team includes 41 employees. Avivi provides web design, CRM consulting & SI, logo design, and other design services. Their client base is almost exclusively comprised of small businesses in the IT industry.",4.9,(12 Reviews),Legato; InterMed GbR; Five Star Claims Adjusting; RestaurantConnect,The client used Avivi to customize their Bitrix instance to match regulations within their industry after other vendors were unable to.,"['Automotive', 'Business services', 'eCommerce', 'Financial services', 'Information technology']","Calgary, Canada",50 - 249 employees,"$10,000+"
Chimpare,blockchain,"Chimpare is a small application development firm. In Whiteley, United Kingdom; New York, New York and Markham, Canada, the firm was launched in 2012. Their services include mobile app development, web development, e-commerce development, ux/ui design, and more.",4.4,(17 Reviews),,A vehicle retailer has hired Chimpare for mobile app development services. They've created the design concept and the database architecture using agile methodology with two-week sprints.,"['Advertising & marketing', 'Arts, entertainment & music', 'Automotive', 'Business services', 'Consumer products & services', 'eCommerce', 'Education', 'Financial services', 'Gaming', 'Government']","Whiteley, United Kingdom",2 - 9 employees,"$5,000+"
Block360,blockchain,"Headquartered in Pakistan with an additional office in Munich, Block 360 is a technology company that specializes in blockchain development, custom software development, and cybersecurity. Since 2017, the team of 50 professionals focuses client efforts on Amazon and linux server platforms.",4.8,(3 Reviews),IBTech; DES Blockchain; GSU.io; Swap Global,Block360 developed a blockchain network and provided consulting services. ,"['Arts, entertainment & music', 'Financial services', 'Government', 'Information technology', 'Real estate', 'Supply Chain, Logistics, and Transport']","Mountain View, CA",10 - 49 employees,"$1,000+"
Renesis Tech,blockchain,"Renesis Tech is a small application development company founded in 2016. Their services include mobile app development, search engine optimization, ux/ui design, branding, and more. The firm is based in Lahore, Pakistan and , Canada.",4.9,(5 Reviews),,"A voice transcription startup hired Renesis Tech to provide custom software development. They built a voice detection AI system from scratch, which they currently support for launch and maintenance.","['Automotive', 'Business services', 'Education', 'Medical', 'Information technology']","Mississauga, Canada",50 - 249 employees,"$25,000+"
Root Codex,blockchain,"Root Codex is a software and web development company that was founded in 2010. The 2-person team is based in Iklin, Malta. They offer services in custom software development, web development, and web design to midmarket and small businesses in spaces such as media, gambling, and advertising and marketing.",5.0,(7 Reviews),HSBC; AOL; Mr. Green; Topdog,"Root Codex designed and developed a WordPress website from scratch. They also consulted on analytics tools for the platform.
 ","['Advertising & marketing', 'eCommerce', 'Financial services', 'Gambling']","L-Imsida, Malta",2 - 9 employees,"$5,000+"
Hashmaker Solutions,blockchain,"#Maker Solutions is a software development company founded in 2015 in Lahore, Pakistan with fewer than 50 employees. They specialize in custom software development, web development, and mobile app development solutions for clients ranging from startups to large businesses.",4.9,(7 Reviews),Dale; Service Bull; Workzone; Nakupa,#Maker Solutions developed a website for an experiential and sound agency. The team was tasked with backend development and support using WordPress. ,"['eCommerce', 'Education', 'Financial services', 'Medical', 'Manufacturing']","Lahore, Pakistan",10 - 49 employees,"$1,000+"
FlawlessMLM,blockchain,,5.0,(3 Reviews),,"Flawless Group was hired to design and develop a gaming platform. They have completed the SDLC model, implemented the development process, and currently provide maintenance.","['Business services', 'eCommerce', 'Education', 'Financial services']","Tallinn, Estonia",50 - 249 employees,"$1,000+"
Around25,blockchain,"Founded in 2006, Around25 is a software development firm that offers mobile app development, blockchain, and web development services to their small business clients in the e-commerce, consumer products and services, and real estate  industries. Their 50 clients are based out of Cluj-Napoca, Romania. ",4.9,(10 Reviews),Bittr; Ebbot; ParamountDax; Dash Delivers,"Around25 designed and developed a modern, fully functional job search platform. They handled all aspects of the project, from UI/UX design and backend development to testing and SEO.  ","['Consumer products & services', 'eCommerce', 'Education', 'Medical', 'Real estate', 'Supply Chain, Logistics, and Transport']","Cluj-Napoca, Romania",10 - 49 employees,"$5,000+"
Pragmatic Coders,blockchain,"Pragmatic Coders is a software development house located in Warsaw and Krakow, Poland. Founded in 2014, the employ        43 staff who specialize in fintech, blockchain, and cloud software development, working with a range of small, midmarket and global businesses. Services include UI and UX design, custom software development, trading platforms, and investment solutions.",4.8,(10 Reviews),Bloc-X; Trade.io; EXCC; Exchange Eldorado,"The client adapts customers' ecommerce products and pages for international markets, requiring translation of language, product sizing and more. Pragmatic Coders has matured with the company, providing six to ten ecommerce developers at a time, specifically working with the Amazon storefront platform.","['eCommerce', 'Financial services', 'Medical', 'Information technology']","Kraków, Poland",50 - 249 employees,"$25,000+"
Savvycom Software,blockchain,"Savvycom Software is a software services company founded in 2009. Headquartered in Hanoi, Vietnam, they also have offices in Mountain View, Calif., and Sydney, Australia. They have a team of 129 employees and their services include mobile app development, custom software development, and web development. They serve small business, midmarket, and enterprise clients in the IT, business services, health care and medical industries. ",4.8,(9 Reviews),North America & Europe: TaylorMade; Automatic; Spectors; Esoftflow,"Savvycom Software fully developed mobile and web apps to promote systems for service quality management. The team worked on design, functionality, UI/UX and system integration.","['Business services', 'Consumer products & services', 'eCommerce', 'Education', 'Financial services', 'Medical', 'Information technology', 'Manufacturing']","Hanoi, Vietnam",250 - 999 employees,"$50,000+"
ServReality,blockchain,"ServReality is an imaginative production house based in Kyiv, Ukraine. Founded in 2013, the company consists of over 50 employees who provide AR/VR development, AI, and mobile app development services.",5.0,(20 Reviews),Volkswagen; Contact; TechSmith; Ookla,A low-code development platform hired ServReality to fix errors and address risks in their application. ServReality integrated multiple systems to enhance the app's protection and ensure the data was secure.,"['Advertising & marketing', 'Arts, entertainment & music', 'Business services', 'Consumer products & services', 'eCommerce', 'Financial services', 'Gambling', 'Gaming', 'Information technology', 'Retail']","Kyiv, Ukraine",50 - 249 employees,"$5,000+"
Marotino INC,blockchain,"Founded in 2018, Marotino INC is located in Burlingame, Calif. With about 10 employees, they provide mobile app development, custom software development, and e-commerce development for enterprise, midmarket, and small businesses.",5.0,(4 Reviews),,Marotino INC built an MVP of an app for an educator sector. The mobile app was compatible with both iOS and Android.,"['Automotive', 'Business services', 'eCommerce', 'Financial services', 'Information technology']","Miami, FL",50 - 249 employees,"$25,000+"
AR++,blockchain,"ArPlusPlus is a Yerevan, Armenia-based app development company. The company specializes in mobile app development and Artificial Intelligence and is small.The company was established in 2016.",5.0,(5 Reviews),,A tech company tapped AR++ to develop a mobile app with a friendly UI/UX that could easily be updated from an admin perspective. They designed the mobile app using Kotlin for Android and Swift for iOS.,"['Medical', 'Information technology', 'Telecommunications']","Yerevan, Armenia",10 - 49 employees,"$5,000+"
Provectus,blockchain,"Reinvently is a mobile strategy and app development agency in Palo Alto, Calif. and Dallas. With a team of about 43 employees, the agency specializes in UI/UX design, research and consulting, and engineering.",4.9,(27 Reviews),Men's Wearhouse; Looksery; Swiftmile; Nickson,Reinvently developed an Android application that allowed users to quickly and easily share multimedia content through messenger apps.,"['Arts, entertainment & music', 'Business services', 'Consumer products & services', 'Financial services', 'Medical', 'Supply Chain, Logistics, and Transport']","Palo Alto, CA",250 - 999 employees,"$25,000+"
Nextbrain,blockchain,"Nextrain Technologies is an IT firm with approximately 54 employees. They were founded in 2016 and are currently headquartered in Bangalore, India. Services include mobile app development, web development, and UX/UI design. Clients are in a variety of sectors. ",4.7,(17 Reviews),Tech Mahindra; LTI (Larsen & Toubro Infotech); JM Baxi; Deliva,Nextbrain Technologies handled both the design and development of a food delivery app. They focused heavily on its UI/UX and also provided a web developer and QA specialists.,"['Advertising & marketing', 'Automotive', 'Consumer products & services', 'Dental', 'eCommerce', 'Medical', 'Hospitality & leisure', 'Manufacturing', 'Real estate', 'Retail']","Bengaluru, India",50 - 249 employees,"$10,000+"
QIT Software,blockchain,"QIT Software is a software company founded in Kharkiv, Ukraine in 2020 with no more than 10 professionals. They provide custom software, web, and mobile app development solutions to small and medium-sized businesses.",5.0,(2 Reviews),Dangl IT GmbH,QIT Software provides development services for a software solutions company. They do maintainable coding for frontend development across multiple projects and define which technologies to use on each of them.,"['Advertising & marketing', 'Arts, entertainment & music', 'Automotive', 'Business services', 'Consumer products & services', 'eCommerce', 'Education', 'Financial services', 'Gambling', 'Gaming']","Plano, TX",10 - 49 employees,"$25,000+"
Blockstars.tech,blockchain,,5.0,(1 Reviews),Coyote Coin; Thrupenny,Blockstars.tech was hired by a cybersecurity company to develop a high-quality web3 product. The client also referred end clients to the vendor when it came to development project inquiries.,"['Financial services', 'Gaming']","Yerevan, Armenia",10 - 49 employees,"$10,000+"
Lead IT,blockchain,"Founded in 2014, Lead IT Team is a software development firm that offers web development, mobile app development, and e-commerce development services to their clients. Their 50 employees are based out of Kyiv.",5.0,(6 Reviews),Audio Tour Mobile App; Giancarlo Orsini; Dispatch; Meebz Coffee Roasters,Lead IT team designed and developed a web-based software solution for streamlining automotive work. It allows mechanics to easily view what they need to work on and what their next tasks are.,"['eCommerce', 'Gambling', 'Manufacturing', 'Supply Chain, Logistics, and Transport']","Deerfield Beach, FL",50 - 249 employees,"$10,000+"
.doCode,blockchain,"Based in L'viv, Ukraine, .doCode Studio is an app development company. The small agency was founded in 2018. Their team offers mobile app development, web development, and ux/ui design.",5.0,(6 Reviews),FinHost; Muniy; Binger,.doCode was hired by a FinTech company to develop a mobile app connected to multiple APIs. The app allows users to send and receive funds from their corresponding bank.,"['Arts, entertainment & music', 'Consumer products & services', 'Financial services', 'Medical']","Tallinn, Estonia",10 - 49 employees,"$10,000+"
Fusion Informatics Limited,blockchain,"Fusion Informatics Limited is an IT outsourcing company in Ahmedabad, India. Founded in 2000, they have about 96 employees that serve clients in a wide range of sectors. Services include AI, mobile app development, and IoT development.",5.0,(1 Reviews),BPCl; Adithya Birla Group; Bosch; United,"Fusion Informatics Limited provided mobile application development services, building an AI-based photo editing app. The solution has several automated features and is suitable for both portraits and selfies.",,India,50 - 249 employees,"$10,000+"
Loominate,blockchain,"Loominate is a creative agency founded in Berlin in 2019 with over two experts. They provide branding, marketing strategy, and digital strategy services for various clients.",4.9,(5 Reviews),Keyko; MXC foundation; Chickai; Alsharq Digital,"Loominate provided digital marketing services for a digital events company. The team was tasked with consulting the content of the client's new site alongside content writing, SEO, and marketing strategy. ","['Arts, entertainment & music', 'Business services', 'Financial services', 'Information technology']","Berlin, Germany",2 - 9 employees,"$5,000+"
Ezetech,blockchain,"Ezetech is a software development company founded in 2015. Based in New York, with an office in Kiev, Ukraine, the team of 21 specializes in custom software development, web development, and blockchain. They primarily serve small businesses in the advertising & marketing, arts, entertainment & music, and business services.",4.9,(9 Reviews),SWAG.COM; SpoiledMedia; Koyfin; Vestwell,"After a previous tech partner left the project incomplete, Ezetech provided the technical expertise to develop a new and improved website with an advanced pricing component.","['Advertising & marketing', 'Arts, entertainment & music', 'Business services', 'Consumer products & services', 'eCommerce', 'Financial services', 'Medical', 'Non-profit', 'Real estate']","New York, NY",10 - 49 employees,"$10,000+"
Dapplica,blockchain,"Dapplica is a blockchain development company founded in San Francisco in 2018 with no more than 50 experts. They specialize in blockchain services, web development, and mobile app development solutions for both small and medium-sized companies.",5.0,(3 Reviews),WAX (Worldwide Asset eXchange); Prospectors.io; Crypto Lions,"Dapplica provided marketing strategy support and smart contract optimization for a product launch. This involved blockchain development, a security audit, and the production of ad content. ","['Advertising & marketing', 'Business services', 'Financial services', 'Gambling', 'Gaming']","San Francisco, CA",10 - 49 employees,"$10,000+"
Julasoft,blockchain,"Julasoft is a development company based in La Plata, Argentina. They have a team of around 10 employees and were founded in 2011. Their services include blockchain and mobile app development for mainly enterprise and midmarket clients. ",5.0,(7 Reviews),Novomet; H&T Presspart (Alemania); Ministerio de Ciencia y Tecnología Argentina; Ministerio de Relaciones Exteriores Argentina,Julasoft provides mobile app development services for a pharmaceutical company. The solution allows patients to capture and measure the amount of medicine in their devices as well as receive notifications.,"['Government', 'GPS, Navigation & GIS', 'Medical', 'Manufacturing', 'Energy & natural resources', 'Non-profit']","City Bell, Argentina",10 - 49 employees,"$10,000+"
Five2One,blockchain,"Five2One is an award-winning app development company founded in 2017 based in Sydney. They are comprised of a team of fewer than 50 experts, offering custom software, mobile app, and web development services using various frameworks such as VueJS, React Native, and NodeJS. They also have experience in working with languages such as JavaScript, Python, and SQL.",5.0,(3 Reviews),PwC.; The United Nations.; AutoTrader - CarsGuide.; The Govt Of India.,"Five2One developed the frontend, backend, and admin panel for a medical mobile app. Built with React Native, the app acts as a job board and matching service for clients, nurses, and caretakers.  ",,"Sydney, Australia",10 - 49 employees,"$25,000+"
codelabs.rocks,blockchain,"A development house headquartered in Opole, Poland, codelabs.rocks was founded in 2018. With additional offices in Tarnów, Poland, their team of fewer than 50 serves small to midmarket businesses in industries such as business services, financial services, and education. Services include custom software, web, mobile app, and e-commerce development.",4.9,(9 Reviews),socialtalent.com; Open Finance; Higma-Service; WeTalk,"Codelabs.rocks provides ongoing development support to assist the in-house team with incoming projects. They’ve worked with WordPress, Laravel, PHP, AngularJS, and React. ","['Business services', 'Education', 'Financial services']","Opole, Poland",10 - 49 employees,"$10,000+"
QSoft Vietnam,blockchain,"QSoft Vietnam is a software development company of 93 employees. Established in 2005, their headquarters is in Hanoi, Vietnam. They offer services in mobile app development, web development, blockchain, and more. They primarily serve small and midmarket businesses, with a focus on the IT and business industries.",4.5,(7 Reviews),AdsGen; Soft Tech Consulting; Inc.; DIS Corporation,"QSoft Vietnam took over the mobile app development for a medical platform, using the remnants to create a working version, as well as a rebuilt and enhanced version. The app is for both iOS and Android.","['Business services', 'Education', 'Gaming', 'Medical', 'Information technology', 'Media', 'Real estate']","Hanoi, Vietnam",50 - 249 employees,"$50,000+"
ADDDEV,blockchain,"Established in 2020, ADDDEV is a website development company. The small team specializes in web development, custom software development, mobile app development, blockchain, and more. The agency is located in Kyiv, Ukraine and Lisbon, Portugal.",5.0,(2 Reviews),,ADDDEV was hired by the organizers of a music festival to develop a new web app with the ability to sell tickets and merchandise via a Weforpay integration.,"['Business services', 'Consumer products & services', 'eCommerce', 'Financial services', 'Information technology', 'Retail']","Kyiv, Ukraine",10 - 49 employees,"$1,000+"
Aurity,blockchain,"Aurity is an IT services provider based in London with other locations in Poland, Spain, and Brazil. Since 2015, their small team of 8 has been specializing in web development, mobile app development, IT strategy consulting, and more for various clients.",4.9,(4 Reviews),Quiqup; Nez; YuLife; Rotageek,"Aurity supported front- and backend mobile app development by providing architecture, API, and UI capacity.","['Business services', 'Financial services', 'Medical', 'Information technology', 'Non-profit', 'Real estate', 'Telecommunications', 'Supply Chain, Logistics, and Transport', 'Utilities']","London, United Kingdom",10 - 49 employees,"$50,000+"
RedSoft Solutions Pvt. Ltd.,blockchain,"RedSoft Solutions Pvt. Ltd. is a web and mobile app development company founded in 2015 with fewer than 10 members. Based in Mumbai, India, they specialize in web and mobile app development for small and medium-sized businesses in the fields of IT as well as business and financial services.",4.9,(9 Reviews),Lucid Labs; Templato,RedSoft Solutions Pvt. Ltd. helped a SaaS platform build a custom React app. They augmented an existing React boilerplate and integrated firebase serverless functions for authentication and database access.,"['Financial services', 'Hospitality & leisure', 'Information technology', 'Manufacturing', 'Real estate']","Thane, India",10 - 49 employees,"$5,000+"
Decipher Zone Technologies Pvt Ltd,blockchain,,5.0,(1 Reviews),,Decipher Zone Technologies Pvt Ltd developed a website and custom software for a software testing company. The goal was to improve communication and collaboration between employees and streamline operations.,"['Business services', 'Consumer products & services', 'eCommerce', 'Education', 'Financial services', 'GPS, Navigation & GIS', 'Medical', 'Hospitality & leisure', 'Information technology', 'Legal Cannabis']","Jaipur, India",50 - 249 employees,"$1,000+"
Techforce Global,blockchain,"Techforce Global is a Naperville, Illinois-based custom software development firm. Founded in 2012, the midsize team focuses on custom software development, ux/ui design, IT strategy consulting, web development, and more.",4.7,(3 Reviews),,Techforce Global provides custom software development services for a financial services company. The team has helped the client with multiple integrations of their payment gateway using Java.,"['eCommerce', 'Education', 'Financial services', 'Government', 'Medical', 'Information technology', 'Legal', 'Manufacturing', 'Real estate']","Naperville, IL",50 - 249 employees,"$5,000+"
Ideofuzion Pvt Ltd.,blockchain,"Ideofuzion Pvt Ltd. is a blockchain-based company based in Islamabad, Pakistan, and founded in 2013. With fewer than 50 employees, they offer blockchain, mobile app development, and IoT development services for clients in the field of IT services.",4.7,(3 Reviews),Appsolutely : Loyalcoin; SyncFab; MedpayRx; Healthport,Ideofuzion Pvt Ltd. is providing blockchain and development services.,['Information technology'],"Islamabad, Pakistan",10 - 49 employees,"$5,000+"
Inovatica,blockchain,"Inovatica is a software offshoring company based in San Diego. Since it was founded in 2008, their team has grown to 20 employees. Inovatica specializes in web, mobile app, and IoT development. Most of their clients are small businesses. ",4.9,(9 Reviews),Google; TransitArt; Message Point; TabKing,"Inovatica replicated an existing iOS app by developing a version for Android. The platform features push notifications, user profiles, and an intricate backend infrastructure that runs various programs.","['Advertising & marketing', 'Government', 'Medical', 'Supply Chain, Logistics, and Transport']","San Diego, CA",10 - 49 employees,"$10,000+"
Apt Software,blockchain,"Application development firm Apt Software was established in 2020. The small Edinburg, Texas-based team provides mobile app development, web development, and blockchain.",5.0,(4 Reviews),"MIT Media Lab - Scaling Science Group; Blueprint Leadership; Infocore, Inc.; Proximity Point City","A training and coaching firm engaged with Apt Software to build an online training platform. The team utilized Vue.js, Django, Python, JSON, Heroku, Netlify, and GitHub as their primary development tools.",,"Edinburg, TX",2 - 9 employees,"$10,000+"
Prolitus Technologies,blockchain,"Prolitus Technologies is an IT solutions provider based in New Delhi, India, that was established in 2005. Their team of 99 employers offers ERP consulting & SI, e-commerce development, custom software development, web development, Blockchain technologies, and AI services.",4.8,(2 Reviews),CoinMD; BatsonDelivery; Libra Mattres,Prolitus is customizing the Odoo ERP software to fit specific business needs. One notable customization is the ability to send out requests for quotations. Prolitus will go on to provide web development.,,"New Delhi, India",250 - 999 employees,"$10,000+"
Frshr Technologies,blockchain,"Launched in 2018, Frshr Technologies is a software development company. Their small team is headquartered in Claymont, Delaware and Bengaluru, India and specializes in custom software development, Artificial Intelligence, mobile app development, and application testing.",,,,,"['eCommerce', 'Education', 'Financial services', 'Information technology', 'Retail']","Claymont, DE",50 - 249 employees,"$10,000+"
DevBrother,blockchain,"Founded in 2017, DevBrother is located in Kharkiv, Ukraine. With 16 employees, they provide web development, custom software development, and blockchain services for enterprise, midmarket, and small businesses. They focus on health care, medical, information technology, and financial services industries.",5.0,(11 Reviews),PurplePass; Vitavie Gallery; PineStore; PineStore,DevBrother provides ongoing web development for a cryptocurrency trading company. Their front- and backend developers continue to buttress the client's internal development team.,"['Arts, entertainment & music', 'eCommerce', 'Financial services', 'Medical', 'Information technology', 'Media', 'Real estate']","Gdańsk, Poland",50 - 249 employees,"$5,000+"
ROOTS INC,blockchain,"Roots Inc is a software development company based in San Salvador, El Salvador. The company, founded in 2017, has a team of less than 15 that provides branding, UX/UI design, cybersecurity, custom software development, and mobile app development services. Roots Inc serves small companies and institutions in the IT, e-commerce, advertising & marketing, and education industries.",4.7,(11 Reviews),Onboardian; bank Atlantida; Ron Cihuatan; Repsol,ROOTS INC provides custom software development services for a law firm. They also helped with the client’s website and IT security. ,"['Advertising & marketing', 'eCommerce', 'Education', 'Financial services', 'Information technology', 'Legal', 'Real estate']","San Salvador, El Salvador",10 - 49 employees,"$10,000+"
