company_name,category,description,overall_rating,review_count,clients,notable_project,industries,location,company_size,min_project_size
Hyperlink InfoSystem,blockchain,"Founded in 2011, Hyperlink InfoSystem is a 250+ team of professionals dedicated to IT services, mobile app development, and ERP/SI consulting. Based in Ahmedabad, the company offers a range of digital solutions from offices in the UK, US, and Australia.",4.8,(126 Reviews),Discovery; Viacom; Disney; Cartoon Network.,"Hyperlink InfoSystem developed a customer- and technician-facing mobile app for an auto detailing franchise. The technology stack included React Native, and the app was built for both iOS and Android devices.","['Advertising & marketing', 'Business services', 'Consumer products & services', 'Gaming', 'Information technology', 'Real estate', 'Supply Chain, Logistics, and Transport']","Ahmedabad, India",250 - 999 employees,"$10,000+"
RNO1,blockchain,"RNO1 is a digital design agency headquartered in California, with offices in Washington and Vancouver. Founded in 2007,  RNO1 has a team of less than 50 and specializes in UX/UI design, web design, web development, marketing strategy, branding, and SEO. ",4.7,(5 Reviews),Airbnb; Microsoft; Ericsson; Disney,"RNO1 designed and updated an existing Squarespace website for an architecture design firm. The website provided buying information for users, and RNO1 helped with establishing a stronger online presence.","['Arts, entertainment & music', 'Business services', 'Consumer products & services', 'Financial services', 'Media', 'Real estate']","San Francisco, CA",50 - 249 employees,"$10,000+"
4soft,blockchain,"4soft is a software house headquartered in Wroclaw, Poland with another office in Dubai, the UAE. Founded in 2013, 4soft's team of 70 employees provides web development, UX/UI design, and custom software development services, having a particular focus on blockchain technology.",5.0,(40 Reviews),Elliptic; Gigaset; Artgeist; ITSEC Asia,"4soft provides custom software development services for a photo wallpaper e-commerce store. They have built a new internal system for managing products, order fulfillment, and returns.","['Arts, entertainment & music', 'Financial services', 'Gambling', 'Gaming', 'Energy & natural resources']","Wrocław, Poland",50 - 249 employees,"$10,000+"
SOTATEK JSC,blockchain,"SotaTek JSC is an AI and blockchain development company based in Hanoi, Vietnam, with offices in Tokyo and Osaka, and Costa Mesa, Calif. The company, founded in 2015, has more than 500 employees and provides blockchain, custom software development, mobile app development, web development, AI, e-commerce development, and IT strategy consulting services. SotaTek serves mid-market and other-sized companies in various industries that include arts & entertainment, business services, and automotive.",5.0,(29 Reviews),Klaytn Foundation; XinFin; Xeno Global; PolkaFoundry,"SOTATEK JSC built a healthcare web app for an IT outsourcing firm's client. The web app would enable patients to choose their preferred doctor, book appointments, and receive online consultations.","['Arts, entertainment & music', 'eCommerce', 'Education', 'Financial services', 'Gaming', 'Medical', 'Real estate', 'Retail', 'Supply Chain, Logistics, and Transport']","Hanoi, Vietnam",250 - 999 employees,"$10,000+"
Suffescom Solutions Inc,blockchain,"Headquartered in India, Suffescom Solutions is an IT firm skilled in web design, web development, and e-commerce development. The team of more than 60 employees serves mostly small and mid-market businesses in the IT, real estate, and advertising and marketing industries.",4.8,(58 Reviews),Morgan Elliott; PC Doctor; Unimilk; LIndsey Reishman Real Estate,Suffescom Solutions Inc developed a service portal for a pest control company. They also helped customize the header and footer design and provided insights about the site's overall structure.,"['Automotive', 'eCommerce', 'Education', 'Financial services', 'Gaming', 'Medical', 'Information technology', 'Real estate', 'Supply Chain, Logistics, and Transport']","CALIFORNIA, CA",250 - 999 employees,"$10,000+"
Newwave Solutions,blockchain,"Headquartered in Hanoi, Vietnam, NewWave Solutions has been a trusted Software Development company since 2011. Their services include web development, application management & support, and mobile app development in addition to IT strategy consulting, custom software development, AI, and blockchain.",4.8,(27 Reviews),UNDP; Axelor; Vingroup; GeekyAnts,"Newwave Solutions designed and developed an e-commerce website for a social media platform. They built the platform from scratch using JavaScript, Python, and Solidity.","['Business services', 'eCommerce', 'Education', 'Financial services', 'Medical', 'Information technology', 'Real estate']","Hanoi, Vietnam",250 - 999 employees,"$10,000+"
EvaCodes,blockchain,"EvaCodes is a full-stack custom software development company based in Kyiv, Ukraine. The company, founded in 2019, has a team of more than ten that provides custom software development, web development, mobile app development, blockchain, and e-commerce development services. EvaCodes serves mid-market and small companies in various industries that include business services, financial services, and consumer products & services.",5.0,(33 Reviews),Synesis One; Yop Finance,EvaCodes provided software development services for an NFT company. They audited the client's smart token contracts and decentralized their system. They also provided cybersecurity services.,"['Business services', 'Consumer products & services', 'Financial services']","Kyiv, Ukraine",50 - 249 employees,"$25,000+"
Peiko,blockchain,"Peiko is an IT development company located in Kyiv, Ukraine. Comprising 19 employees, they develop software solutions for various sized companies in IT, business services, finance, and healthcare. Services include frontend and backend development, UX and UI design, database management, testing, QA, and website management.",5.0,(34 Reviews),"OrionProtocol (Top 250 Cryptocurrencies on CoinMarketcap. The first gateway to the entire crypto market: aggregating every CEX, DEX, and swap pool into one decentralized platform. The market cap of ORN is 250 000 000$); LocalAway (Silicon Valley marketplace); Riabu, ContactsBook, Investros Exchange (SaaS projects of HongBao Media); GS Diamonds (Australian gewelry eCommerce)","Peiko has helped an IT company develop an MVP for an NFT marketplace. They've identified the platform's technical specifications, worked on the product design, and implemented it in code.","['Business services', 'eCommerce', 'Financial services']","Kyiv, Ukraine",50 - 249 employees,"$10,000+"
Webisoft,blockchain,"Webisoft is a full-service web and mobile development company based in Montreal, Canada. The company, founded in 2016, has a team of more than ten that provides web development, custom software development, mobile app development, UX/UI design, and IoT development services. Webisoft serves small and larger-sized companies in various industries that include business services, IT, and e-commerce. ",4.9,(7 Reviews),Cogeco; Astral Media / Bell; Proprio Direct; Edigo,"A payments solutions company hired Webisoft to provide blockchain development. They used Python, Node.js, and TypeScript to create an onramp from Fiat to Cryptocurrency as payment methods.","['Automotive', 'Business services', 'eCommerce', 'Gambling', 'Information technology']","Montreal, Canada",10 - 49 employees,"$5,000+"
Systango,blockchain,"Established in 2007, Systango Technologies is a global digital product development agency. They are headquartered in London and have additional international offices. Most clients are small businesses, many of which are in the entertainment, utilities, and hospitality sectors. ",4.8,(28 Reviews),MGM; Target; Grindr; Deloitte,"Systango helps a matching services company build a custom algorithm-based matching tool in WordPress and PHP. The team has automated various company services, including business email in Zoho.","['Arts, entertainment & music', 'Business services', 'Consumer products & services', 'Education', 'Financial services', 'Gaming', 'Government', 'Hospitality & leisure', 'Information technology', 'Non-profit']","London, United Kingdom",250 - 999 employees,"$5,000+"
"""Monkhub Innovations""",blockchain,"Monkhub Innovations, a mobile app development firm, is based in New Delhi, India. They provide mobile app development, ux/ui design, AR/VR development, blockchain, and more and were founded in 2017.",5.0,(16 Reviews),,"An IT consulting company hired Monkhub Innovations for their expertise in web and mobile application development, software engineering, and technology consulting services.","['Arts, entertainment & music', 'Business services', 'Consumer products & services', 'eCommerce', 'Education', 'Financial services', 'Gambling', 'Gaming', 'Medical', 'Media']","New Delhi, India",50 - 249 employees,"$10,000+"
SoluLab,blockchain,"Founded in 2013, SoluLabs is a mobile app and custom development firm based in Ahmedabad, India. SoluLabs currently employs more than 60 developers with a range of specialties – from mobile app development to blockchain to IoT development to SaaS product development.",4.8,(38 Reviews),Casting Workbook; Cambridge University; UnionEdge; Igniter100,"SoluLab developed an iOS and Android app in two weeks with the same code base. The app has three distinct types of users: mentors, entrepreneurs, and program administrators. Mentors provide feedback and advice to entrepreneurs and the administrators administer the programs that support entrepreneurship. The app, MELSTM, makes the interaction between mentor and entrepreneur more effective and efficient while collecting information on meetings, topics, and action for use in improving the entrepreneurship programs. Since the original prototype, the client has used SoluLab for additional features. ","['Arts, entertainment & music', 'Education', 'Financial services', 'GPS, Navigation & GIS', 'Medical', 'Real estate', 'Supply Chain, Logistics, and Transport']","Los Angeles, CA",50 - 249 employees,"$25,000+"
Wow Blockchain Labz,blockchain,"Wow Labz is a web and app development company based in Bangalore, India. Founded in 2011, the team of 63 specializes in mobile app development, web development, and UX/UI design. They work primarily with small business and enterprise clients, mainly in the consumer products and services industry. ",5.0,(15 Reviews),AB InBev; Emaar Group; Schneider Electric; Star Group,Wow Blockchain Labz has developed a social network platform for a real estate consulting firm. They work on integrating seven areas of an ecosystem in one unified platform.,"['Arts, entertainment & music', 'Consumer products & services', 'Education', 'Financial services', 'Gaming']","Bengaluru, India",50 - 249 employees,"$50,000+"
Antier Solutions,blockchain,"Antier Solutions was founded in 2009. They are a software developer based in Punjab, India. Their team of 110 employees specialize in blockchain, mobile app, and web development for primarily midmarket businesses in the advertising, business services, and customer products industries.",5.0,(8 Reviews),121with - UK; Pocial-California; Zon-US; AHG Group-Australia,Antier Solutions developed a decentralized cryptocurrency wallet for a software company in five days. The team assessed the client's errors in the code and rectify them before launching the product.,"['Advertising & marketing', 'Business services', 'Consumer products & services', 'Financial services', 'Medical', 'Information technology', 'Real estate']","Sahibzada Ajit Singh Nagar, India",50 - 249 employees,"$10,000+"
MetaLamp,blockchain,"MetaLamp is a website development firm. Established in 2014, the midsize company is located in Tomsk, Russia. Their services include web development, blockchain, IT staff augmentation, and mobile app development.",5.0,(27 Reviews),Focused on blockchain development and working with blockchain-startups,MetaLamp developed a website for a trading platform. They used React to build the frontend of the product.,"['Business services', 'Financial services', 'Information technology']","T'bilisi, Georgia",50 - 249 employees,"$10,000+"
PixelPlex,blockchain,"PixelPlex is a software and blockchain development company headquartered in New York City, with offices in London-UK, Pfäffikon-Switzerland, Tokyo-Japan, and Seoul-South Korea. Founded in 2007, the team of 130+ specializes in blockchain, custom software development, and mobile app development. They work mostly with enterprise and mid-market clients, primarily in the financial services industry. ",4.9,(25 Reviews),Microsoft; Oracle; BMW; Intel,"PixelPlex designed and developed an NFT marketplace for a technology company. They built the product from scratch using C++, C#, Solidity, and an Ethereum smart contract.","['Business services', 'eCommerce', 'Financial services', 'Government', 'Energy & natural resources', 'Real estate', 'Retail']","New York, NY",50 - 249 employees,"$25,000+"
Infograins,blockchain,"Infograins Software Solutions Pvt. Ltd. Is a small blockchain company based in Indore, India. Established in 2011, the team provides blockchain, mobile app development, Artificial Intelligence, IoT development, and more.",5.0,(38 Reviews),,"Infograins is developing a website for a blockchain company. The site allows users to book travel, lodging, and other services. They are also creating a digital wallet where users can store their coins.","['Arts, entertainment & music', 'Gambling', 'Gaming', 'Information technology']","New York, NY",50 - 249 employees,"$10,000+"
SpaceDev,blockchain,"SpaceDev is a software factory based in Montevideo, Uruguay. The factory, founded in 2017, has a team of around 20 that provides custom software development, web development, and mobile app development services to small and larger-sized companies and institutions in various industries.",5.0,(21 Reviews),NDAX.io; Flexio; ScotiaBank; DLocal,"Using existing designs and prototypes, SpaceDev is helping a petcare marketplace migrate their app to React Native. They're also building new features to be added to the app. Five teammates work on the project.",['Information technology'],"Montevideo, Uruguay",10 - 49 employees,"$50,000+"
Interexy,blockchain,"AMS LLC is a development agency in Cherry Hill, N.J. and Minsk, Belarus. Founded in 2017, they have about 20 employees that serve mostly small-business and midmarket clients in the transportation, education, and financial sectors. Their services are specialized in mobile app development.",4.9,(35 Reviews),Sandbox; Lil Durk; General Electric; Square Inc.,Interexy designed the product’s UI and developed a mobile application and an admin panel for a mental health platform. The app was an onboarding system for patients that used bank IDs to log in.,"['eCommerce', 'Education', 'Financial services', 'GPS, Navigation & GIS', 'Medical', 'Hospitality & leisure', 'Information technology', 'Media', 'Supply Chain, Logistics, and Transport']","Lauderdale-by-the-Sea, FL",50 - 249 employees,"$10,000+"
Crypton Studio,blockchain,"Crypton Studio is a software company based in Riga, Latvia, and founded in 2015. With over 10 employees, they offer blockchain, mobile app development, and web development solutions to small and medium-sized businesses alike.",5.0,(7 Reviews),"Decimal, Samurai, Workquest, BitTeam, Polylastic, Decentraland.","Crypton Studio has designed the UI for a cryptocurrency company's product, and they're now developing it. They're building the solution in the Polygon platform using smart contracts and running security tests.","['eCommerce', 'Education', 'Financial services', 'Gambling', 'Gaming', 'Government', 'Real estate']","Rīga, Latvia",50 - 249 employees,"$10,000+"
Labrys,blockchain,"Labrys is a blockchain development and consulting company located in Brisbane, Australia. Founded in 2017, they continue to provide blockchain, custom software, and mobile app development services. They have about 11 employees.",5.0,(3 Reviews),TracerDAO; Swell Network; EarthFund DAO; Downer Group,"A bitcoin brokerage service chose Labrys as a partner to take charge of the application design and development, as well as the management of their project.","['Advertising & marketing', 'Arts, entertainment & music', 'Business services', 'Consumer products & services', 'eCommerce', 'Education', 'Financial services', 'Gambling', 'Gaming', 'Government']","Fortitude Valley, Australia",10 - 49 employees,"$50,000+"
Unicsoft,blockchain,"Unicsoft is a blockchain and artificial intelligence development company headquartered in Kyiv. Founded in 2005, the team of 120 experts specializes in blockchain, AI, big data, predictive analytics, cryptocurrency solutions, custom software development, web, and mobile development. They provide fully-managed and dedicated team services for the sustainable growth of SME and start-ups, primarily in the supply chain and fintech industries.",4.9,(32 Reviews),MakerDAO; SoccerCoin; Hoodifood; Niftables,"Unicsoft developed a billing module for a SaaS company. They integrated the module with the client's existing system, designed the UI/UX, and provided QA and management services.","['Advertising & marketing', 'Automotive', 'Financial services', 'GPS, Navigation & GIS', 'Medical', 'Information technology', 'Manufacturing', 'Retail', 'Supply Chain, Logistics, and Transport']","London, United Kingdom",50 - 249 employees,"$25,000+"
Talentica Software,blockchain,"Talentica Software is an innovative product development company for high-growth companies. With 18 years of experience across various domains of 170 customers, the company has developed deep expertise in AI & Machine Learning, and Blockchain. Expertise in these emerging technologies and understanding the business context help bring product features to life. They have a team of 500+ experienced & handpicked tech experts hailing from the premier engineering schools of India like IITs, NITs & BITs.",4.7,(22 Reviews),Mist Systems; Alphasense; Tala Security; Citrus Pay,"Augmenting a channel marketing automation platform's R&D capabilities, Talentica Software helps the client develop their main product. They maintain the product, fix bugs, and create new software capabilities.","['Advertising & marketing', 'Consumer products & services', 'eCommerce', 'Financial services', 'Medical', 'Media', 'Real estate']","Pune, India",250 - 999 employees,"$50,000+"
Plavno,blockchain,"Plavno, a website development firm, is based in Nur - Sultan, Kazakhstan. They offer web development, mobile app development, and blockchain and were founded in 2007.",5.0,(19 Reviews),"Mercedes, Xerox, Kia, eBay, PayPal, Amazon , IBM, Bank, Mediacube","Plavno developed a digital university admissions platform for a web development company. They designed the UX/UI for three user groups, and built the platform using React.js, Python, C# and other tools, ","['eCommerce', 'Education', 'Financial services', 'Gambling', 'Medical']","Warszawa, Poland",50 - 249 employees,"$10,000+"
Innowise Group,blockchain,"Innowise Group is a custom software development company based in Warsaw, Poland. With more than 1000 specialists on board and 600 projects completed, they use cutting-edge technologies to transform their client's businesses. They are experts in designing and developing tech solutions that will help your company enhance its processes and increase customer satisfaction, thanks to their 15+ years of experience and extensive expertise. They create custom software to fit your unique requirements in terms of timeline, budget, and use case. They handle every step of the development process, from product concept and development to testing, deployment, and support. In addition to building custom software, we also excel in UX/UI design, IT strategy consulting, and staff augmentation.",4.8,(40 Reviews),Terraces.io; Voka; Belyagdar; Instatsport,A digital healthcare company hired Innowise Group to provide mobile app development. They created a platform for respiratory conditions that analyzes inhalation flow and allows users to record symptom data.,"['Education', 'Financial services', 'Medical']","St. Petersburg, FL","1,000 - 9,999 employees","$5,000+"
CGS-team,blockchain,"Code Generation is a software company founded in Kharkiv, Ukraine in 2017 with over 10 employees. They are experts in custom software, web, and mobile app development services for small businesses in the fields of healthcare, education, and business services.",4.9,(8 Reviews),IBM; HomeLike; Atlassian; Awes Ventures LLC,"CGS-team provided mobile app development support to a web and SEO agency's client. They fixed the app's bugs related to the notification system, translations, image uploading, categories, and authentication.","['Business services', 'Financial services', 'Medical']","Paphos, Cyprus",50 - 249 employees,"$5,000+"
iTechArt Group,blockchain,"Headquartered in New York, iTechArt is a custom software development company with additional offices in Marietta, Ga. and Iselin, N.J. Since 2002, iTechArt has helped startups and fast-growing tech companies fill in their talent gap and create robust web and mobile solutions that users love. To date, iTechArt’s talent pool includes 3500+ engineers with experience in all of the latest technologies.",4.9,(52 Reviews),ClassPass; ZEFR; Gain Capital (forex.com); Merkle,"iTechArt Group's engineers help a fintech firm with the development of their services. Some of their tasks include user onboarding, user account creation, tenant configuration management, and authentication.","['Education', 'Financial services', 'Gaming', 'Medical']","New York, NY","1,000 - 9,999 employees","$25,000+"
Debut Infotech,blockchain,"Headquartered in Mohali, India, Debut Infotech also maintains a US presence with its Chicago office. Debuting in 2012, they’ve grown to almost 100 employees who are dedicated to both web and mobile app development.",4.8,(22 Reviews),Everledger; iFinca; HDFC Bank; KFC,Debut Infotech developed an iPad-based invoicing and digital record keeping application for a third party client. The team also integrated email tracking and scheduling functionalities.,"['Business services', 'Consumer products & services', 'eCommerce', 'Education', 'Financial services', 'Medical', 'Hospitality & leisure', 'Information technology', 'Retail']","Sahibzada Ajit Singh Nagar, India",50 - 249 employees,"$10,000+"
482.solutions,blockchain,"482.solutions is a blockchain development and consulting firm that was founded in 2013. They employ 34 staff in their office in Odesa, Ukraine, where they provide innovated blockchain engineering for small and midmarket companies in fintech, energy, and e-government. Services include custom software development, security, and IoT development.",4.9,(10 Reviews),Ambrosus; REMME; Worldbiz; Miralab,"482.solutions developed custom software for a low-carbon, customer-centric electricity system nonprofit. The team built a decentralized identity library that included key security considerations.","['Business services', 'Education', 'Government', 'Information technology', 'Energy & natural resources']","Singapore, Singapore",50 - 249 employees,"$10,000+"
The NineHertz,blockchain,"The NineHertz is a 200+ mobile app and web development company based in Jaipur, India with offices in Australia, Dubai, California, and Cincinnati, OH. The team has created thousands of apps for small to midsize businesses since its start in 2008.",4.8,(103 Reviews),JMRC (Jaipur Metro Rail Corporation); Casio  Samsung Reliance Jio Air Asia,An import and export company hired The NineHertz to develop their e-commerce website. They created a task force of developers and designers to execute the project after issues were raised. ,"['eCommerce', 'Education', 'Financial services', 'Gaming']","Cincinnati, OH",50 - 249 employees,"$5,000+"
Codiste pvt ltd,blockchain,"Codiste pvt ltd is a blockchain company. Located in Ahmedabad, India, their small team offers blockchain, mobile app development, and web development. The firm was founded in 2019.",4.9,(8 Reviews),Bonfire Capital; Decentralized Crypto Launchpad,Codiste pvt ltd has developed a wallet application for a crypto startup. They have built the front- and backend to create a platform with standard and new functionalities.,"['Arts, entertainment & music', 'Business services', 'Education', 'Financial services', 'Gaming', 'Information technology', 'Real estate']","Ahmedabad, India",10 - 49 employees,"$5,000+"
Artkai,blockchain,"ARTKAI is a full-cycle digital product development and consulting company with an emphasis on UX. Founded in 2014, they have about 100 employees and work with SME’s from the US and EU markets. Their team takes care of Web and Mobile Development, UX/UI Design, and Digital Transformation of Businesses from initial research to complete product.",4.9,(32 Reviews),Huobi Global (Crypto exchange platfrom); Nezha (Blockchain prediction market protocol); CEX.io (Crypto exchange app); Advanced Markets (Cryto Investments Consulting),Artkai provides UX/UI design services for a luxury spirits and wines startup. They’ve worked on designs and prototypes for a platform that enhances the ownership experience with interactive bottles and NFTs.,"['Business services', 'Financial services']","Kyiv, Ukraine",50 - 249 employees,"$25,000+"
