company_name,category,description,overall_rating,review_count,clients,notable_project,industries,location,company_size,min_project_size
Yalantis,internet-of-things,"Web and mobile app development company Yalantis is based in Ukraine. Founded in 2008, the team of nearly 200 employees is fluent in web, Android, and iOS development – Swift, Kotlin, JavaScript, Ruby, Node.Js, Goland, and more.",4.8,(47 Reviews),KPMG; Zillow; Toyota Tsusho; Healthfully (US Healthcare web platform),Yalantis provided UI/UX design and mobile app development for an audiobooks and podcasts platform. The team used Flutter for design and developed the app using Go for Android and Swift for iOS.,"['Financial services', 'Medical', 'Information technology', 'Supply Chain, Logistics, and Transport']","Warszawa, Poland",250 - 999 employees,"$25,000+"
Netizens,internet-of-things,"Netizens is a software house based in Katowice, Poland. They were founded in 1999 and have 50 employees. Along with  IoT development, they also specialize in custom software, mobile app, and web development. They mostly work with midmarket clients in the business services, consumer products, and advertising industries.",4.8,(15 Reviews),Samsung; Janssen; Whisbear; Saint Gobain,"Netizens developed an event logistics app using beacon technology. The app directed attendees to assigned transportation, synced with personal schedules and provided workshop reminders, and facilitated polls.","['Advertising & marketing', 'Business services', 'Consumer products & services', 'Medical']","Katowice, Poland",50 - 249 employees,"$10,000+"
LANARS,internet-of-things,"LANARS is a digital agency based in Dnipro, Ukraine. Founded in 2015, it has approximately 57 employees. They focus on mobile app development, IoT development, and other app development.",5.0,(13 Reviews),Memento; Byzans; Tweego; Liquid Tool,A manufacturing firm hired LANARS for their mobile app development services. The app's features included displaying and reporting torque values. A project manager and Flutter developers worked on the project.,"['Automotive', 'Business services', 'Financial services', 'GPS, Navigation & GIS', 'Medical', 'Manufacturing', 'Media', 'Real estate', 'Retail', 'Supply Chain, Logistics, and Transport']","Oslo, Norway",50 - 249 employees,"$25,000+"
Very,internet-of-things,"'Very is an IoT technology firm led by expert problem-solvers to create efficient, scalable solutions that move commercial, industrial and consumer IoT projects from pilot to production in record time. From smart products in homes and businesses to end-to-end smart ecosystems, Very solves complex problems with a strategic, collaborative, and user-centered process designed to ensure every element of the problem is understood before developing solutions.",4.8,(12 Reviews),Vizio; Peloton; Interstate Batteries; Loreal,"By teaming up with Very, SUN was able to develop Helios, a hardware and software edge computing solution that collects machine data, facilitating analysis and understanding of machine health.","['Medical', 'Manufacturing', 'Energy & natural resources', 'Utilities']","Bozeman, MT",50 - 249 employees,"$250,000+"
INTEGRA SOURCES,internet-of-things,,4.9,(22 Reviews),Red Pitaya; Simple Robots; GeoMoby; DaVinci Learning,"INTEGRA SOURCES is developing custom software and hardware to revamp a medical device for a hospital. They’re building features to monitor the patient’s blood oxygen levels, heart rate, and blood pressure.","['Consumer products & services', 'Education', 'GPS, Navigation & GIS', 'Medical', 'Information technology', 'Energy & natural resources', 'Telecommunications', 'Supply Chain, Logistics, and Transport']","Nur-Sultan, Kazakhstan",50 - 249 employees,"$10,000+"
intent,internet-of-things,"Intent (formerly inFullMobile) is a Warsaw, Poland based app and software development firm that was founded in 2008. They have 35 employees and their team focuses on mobile app development, UX/UI design, and custom software development. They mostly work with enterprise clients in the consumer products, information technology, and business services industries.",4.9,(28 Reviews),P&G; Samsung; Conde Nast; Nike,"A software and design agency was in the midst of diversifying their business, so they engaged with intent to build and develop a CRM dashboard to simplify the customer experience.","['Arts, entertainment & music', 'Automotive', 'Consumer products & services', 'eCommerce', 'Gaming', 'Medical', 'Real estate']","Warszawa, Poland",50 - 249 employees,"$50,000+"
Intuz,internet-of-things,"Intuz is a premier digital agency based in San Jose, Calif. that provides end-to-end custom software application development services on Mobile, Web, IoT & Blockchain. Founded in 2008 with offices in San Francisco & India, their 50+ team have a proven track record of delivering cutting-edge mobile apps, digital products and web applications for Startups, SMBs to Fortune 500 companies.",4.7,(41 Reviews),"Bosch; Jones Lang LaSalle; Mercedes AMG; Cambridge Publications, Inc",Intuz developed custom data conversion software for a private investment firm. They built a solution that converts data from one reporting agency and makes it compatible with another program.,"['Business services', 'Manufacturing', 'Energy & natural resources', 'Utilities']","San Francisco, CA",50 - 249 employees,"$25,000+"
AJProTech,internet-of-things,"AJProTech is a Los Angeles, California-based IoT development company. The small agency was founded in 2014. Their services include IoT development, product design, custom software development, and mobile app development.",5.0,(7 Reviews),Exxon Mobile; Google; Fedora Lab; Hyundai,AJProTech created a gaming startup's hardware device prototype. Their task was to connect the prototype to a framework and software through IoT. The team shared their idea and sketches to kickstart the project.,"['Consumer products & services', 'Medical', 'Information technology', 'Manufacturing']","Los Angeles, CA",10 - 49 employees,"$50,000+"
EMBIQ,internet-of-things,"EMBIQ is a software development company based in Lublin, Poland. They have a team of around 40 employees and were founded in 2009. Their services include web and mobile app development, and application testing. ",4.9,(25 Reviews),Spark Control; Onsite Data Intellgence; Eltcrac; TerraLand,"EMBIQ has built an IoT automated testing device for a home solutions firm following the client's requirements. They've tested, implemented, and QA'd the solution, which was built using Python and Raspberry Pi. ","['Business services', 'Financial services', 'Information technology', 'Supply Chain, Logistics, and Transport']","Lublin, Poland",10 - 49 employees,"$10,000+"
Indeema Software Inc.,internet-of-things,"Indeema Software is a software development company based in Lviv, Ukraine, with an office in Seattle. Founded in 2014, the team of 38 specializes in IoT development, blockchain, and web development. They work primarily with small business clients, mostly in the business services industry.",5.0,(17 Reviews),Solar Manager; UDB; iReds; Vidisi,"A wifi gauge manufacturer works with Indeema Software Inc. for custom software development. The team focuses on correcting bugs, updating the admin panel and mobile app, and enhancing and testing the product.","['Arts, entertainment & music', 'Business services', 'Gaming', 'Medical', 'Information technology', 'Telecommunications', 'Supply Chain, Logistics, and Transport']","L'viv, Ukraine",50 - 249 employees,"$5,000+"
Waverley Software,internet-of-things,"Waverley Software is a software engineering company headquartered in Palo Alto, Calif. It also has offices in Boston, Kharkiv, Ukraine, Lviv, Ukraine, and Ho Chi Minh, Vietnam. Founded in 1992, Waverley's team of over 80 employees mainly provides midmarket brands around the world with custom software development, mobile app development, and IoT development services.",4.9,(36 Reviews),Mozilla; Qualcomm; Swisscom; GroupOn,A personal journaling app engaged with Waverley Software for their iOS-based mobile app development services. The team manages the entire project and utilizes Swift UI as their primary development tool.,"['Education', 'Financial services', 'Medical']","Palo Alto, CA",250 - 999 employees,"$50,000+"
Innowise Group,internet-of-things,"Innowise Group is a custom software development company based in Warsaw, Poland. With more than 1000 specialists on board and 600 projects completed, they use cutting-edge technologies to transform their client's businesses. They are experts in designing and developing tech solutions that will help your company enhance its processes and increase customer satisfaction, thanks to their 15+ years of experience and extensive expertise. They create custom software to fit your unique requirements in terms of timeline, budget, and use case. They handle every step of the development process, from product concept and development to testing, deployment, and support. In addition to building custom software, we also excel in UX/UI design, IT strategy consulting, and staff augmentation.",4.8,(40 Reviews),Terraces.io; Voka; Belyagdar; Instatsport,A digital healthcare company hired Innowise Group to provide mobile app development. They created a platform for respiratory conditions that analyzes inhalation flow and allows users to record symptom data.,"['Education', 'Financial services', 'Medical']","St. Petersburg, FL","1,000 - 9,999 employees","$5,000+"
N-iX,internet-of-things,"N-iX is an Eastern European software development service company with headquarter in Lviv, Ukraine. Founded in 2002, N-iX has increased its presence in six countries spanning Europe and the US.",4.8,(29 Reviews),Fortune 500 companies; AVL; Saks Fifth Avenue; TuneIn,"N-iX provided primarily Java-based functional development, building applications on top of existing framework. The team managed large amounts of complicated, aggregated data and used specific language skills.","['Business services', 'Education', 'Financial services', 'Medical', 'Hospitality & leisure', 'Manufacturing', 'Media', 'Energy & natural resources', 'Telecommunications']","Valletta, Malta","1,000 - 9,999 employees","$100,000+"
EffectiveSoft,internet-of-things,"EffectiveSoft is a software development company with more than 20 years of professional experience and 300+ employees. Their key competence in recent years has been dedicated to fintech and healthcare. They are headquartered in San Diego and have offices in London, West Burlington, Mass., and Minsk, from which they offer both a local and offshore presence. ",4.9,(14 Reviews),,EffectiveSoft provides staff augmentation services to a software development company. They help the client extend their web app with mobile capabilities and other significant features.,"['Financial services', 'Medical', 'Information technology']","San Diego, CA",250 - 999 employees,"$25,000+"
Grinn,internet-of-things,"Located in Wrocław, Poland, Grinn is a midsize custom software development company. Established in 2008, the team specializes in custom software development, IoT development, IT managed services, product design, and more.",4.8,(7 Reviews),,An industrial appliance maintenance company has engaged with Grinn for IoT development. The team has implemented a new design and created new features relevant to network technology and battery.,"['Automotive', 'Consumer products & services', 'GPS, Navigation & GIS', 'Medical', 'Hospitality & leisure', 'Information technology', 'Manufacturing', 'Telecommunications', 'Supply Chain, Logistics, and Transport']","Wrocław, Poland",50 - 249 employees,"$10,000+"
DataArt,internet-of-things,"DataArt is a software engineering firm in München, Germany; Zug, Switzerland; London, England; and New York. Founded in 1997, they have about 3,000 employees that serve mainly midmarket and small-business clients in the financial, healthcare, and IT sectors. Services include custom software development, enterprise app modernization, and UI/UX design.",5.0,(14 Reviews),The Carlyle Group; Nasdaq; Apax Partners; Monex,DataArt provides e-commerce solutions for a B2B marketplace. The team is responsible for creating an automated and scalable solution that can be operated in multiple countries.,"['eCommerce', 'Financial services', 'Medical', 'Hospitality & leisure', 'Media', 'Retail']","New York, NY","1,000 - 9,999 employees","$100,000+"
You are launched,internet-of-things,"molfar.io is a software development company based in Dnipro, Ukraine. Founded in 2016, molfar.io and its team of around 10 employees provides mobile app and web development, and UX/UI design services to small and mid-market businesses. They primarily work with those in the healthcare & medical, hospitality, and IT industries.",5.0,(38 Reviews),"""I decided to work with a Ukrainian company, I finalized a list of three companies. You are launched felt like more of a business partner, and they helped us come up with ways to grow the business."" - Sean Cornelius; ""They began by evaluating the demo video we had composed, and reverse engineering what will be necessary from a resource perspective to deliver."" Manuel Porter; ""They have excellent communication and are even better at determining what we’re trying to accomplish and figuring out how to get it done."" - Brent Kruel; ""You are launched takes care of everything. They really guide us by asking us what we want and then letting us know what we need. They help us test and release the app as quickly as possible."" - David Whalen","You are launched is developing a branding app for an educational project. The team's responsibilities include conceptualization, UI/UX design, and app development.","['eCommerce', 'GPS, Navigation & GIS', 'Medical']","Dnipro, Ukraine",10 - 49 employees,"$25,000+"
SAPHI,internet-of-things,"SAPHI is an IoT development company. They are in Lambton, Australia and have a small team. Their services include IoT development, custom software development, mobile app development, and web development. The firm was established in 2017.",5.0,(6 Reviews),NSW Department of Primary Industries; BHP; Orica; Sydney School of Entrepreneurship,SAPHI conducted managed IT services for a local government organization. They evaluated the client's new tech stack using data integration and visualization.,"['Government', 'Energy & natural resources']","Warners Bay, Australia",10 - 49 employees,"$25,000+"
Accelerance,internet-of-things,"Accelerance is a small IT strategy consulting company. The Redwood City, California-based firm was established in 2001. Their services include IT strategy consulting, custom software development, IT staff augmentation, enterprise app modernization, and more.",5.0,(27 Reviews),Acrowire; Find.com; MediaPro; AdRoll,"Accelerance has provided recruitment support to a cloud services company. They have been responsible for sourcing developers, QA, and scrum leaders to assist with a variety of development projects. ","['eCommerce', 'Education', 'Financial services', 'Medical', 'Information technology', 'Supply Chain, Logistics, and Transport']","Redwood City, CA",10 - 49 employees,"$100,000+"
SoftwareHut,internet-of-things,"SoftwareHut is a software development house with offices around the world, including London, New York, Paris, Munich, Dublin, Stockholm, Copenhagen and Zurich. Founded in 2015, they also have seven offices in Poland, including Bialystock, Olsztyn, Przemysl, Szczecin, Warsaw, Wroclaw, and Poznan. They employ 173 staff specializing in designing, customizing and developing professional IT systems, LIMS, SCM, and mobile apps.",4.8,(27 Reviews),Microsoft; Sonetel; QBank; Skyscanner,"SoftwareHut provides development resources for a SaaS company. The developers handle the firm's data analysis, web development, and business analysis needs. Around four teammates are assigned to the client.","['Business services', 'Consumer products & services', 'eCommerce', 'Education', 'Financial services', 'Government', 'Medical', 'Hospitality & leisure', 'Information technology', 'Legal']","Białystok, Poland",250 - 999 employees,"$5,000+"
ArcTouch,internet-of-things,"ArcTouch was founded in 2008 and has offices in San Francisco, Calif., New York, and Florianópolis, Brazil. They excel at app development, blockchain, and UX/UI design. They guide their enterprise clients through the app building process by defining a strategy for the best user experience, planning the visual design, developing and testing the prototype, and ensuring optimization and growth.",4.9,(28 Reviews),,"ArcTouch was directly involved in creating a mobile app for a luxury electric vehicle automaker. They aimed to integrate their products with IoT assistants such as Apple Watch, Siri, and Google assistant. ","['Consumer products & services', 'eCommerce', 'Financial services', 'Medical', 'Hospitality & leisure', 'Media', 'Retail']","San Francisco, CA",50 - 249 employees,"$100,000+"
Solwit SA,internet-of-things,"Solwit SA is a custom software development firm based in Gdańsk, Poland. Founded in 201, their team of 500 serves clients in the IT, Financial services and utilities sectors. Services include NodeJS, AngularJS, and .NET development.",5.0,(8 Reviews),,"Solwit SA developed a web app for a car rental company. They designed the solution, hosted the backend in AWS, and built the frontend using Angular, Amazon DynamoDB, AWS Amplify, AppSync, Lambda, and .NET Core.","['Automotive', 'Financial services', 'Medical', 'Information technology', 'Manufacturing', 'Retail', 'Utilities']","Gdańsk, Poland",250 - 999 employees,"$5,000+"
Softeq,internet-of-things,"Softeq is a full-stack development company for web and mobile that’s headquartered in Houston, TX. Founded in 1997, the team of 200+ offers the rare combination of app software and hardware-level expertise – from backends to business intelligence, firmware to IoT (internet of things).",4.9,(26 Reviews),Microsoft; Intel; Nike; Epson,"Softeq provides contract software development services for special projects, game development, and game ports. They recently completed an adaptation for specific hardware and developed screen savers and utilities.","['Automotive', 'Business services', 'Education', 'Gaming', 'Medical', 'Information technology', 'Media', 'Energy & natural resources', 'Real estate']","Houston, TX",250 - 999 employees,"$50,000+"
FiveDotTwelve,internet-of-things,"Based in Łódź, Poland, FiveDotTwelve is a software development company that was founded in 2015. Their team of 14 are experts in mobile app, internet of things, and web development. ",4.9,(28 Reviews),Onoco; Squaddy; Autenti; Knauf,FiveDotTwelve designed and developed a club promotion company's web app and mobile app for iOS and Android. They based the design on the client's previously prepared concept for the project.,"['Advertising & marketing', 'Arts, entertainment & music', 'Financial services', 'Telecommunications']","Łódź, Poland",10 - 49 employees,"$25,000+"
xBerry,internet-of-things,"xBerry R&D House is an IT company in Wrocław, Poland. Founded in 2014, they have about 16 employees that service small-business and midmarket clients in the manufacturing, business, and consumer products sectors. Services include custom software development, IT staff augmentation, and AR/VR development.",5.0,(10 Reviews),Szajna; UltraSpotter; Müller Apparatebau; Cesar,"A parking system services provider hired xBerry R&D House for IoT development. They created and integrated new functionalities like online reservation, license plate recognition, and elastic container registry.","['Medical', 'Legal', 'Manufacturing', 'Real estate', 'Supply Chain, Logistics, and Transport']","Wrocław, Poland",50 - 249 employees,"$5,000+"
VOLO,internet-of-things,"Volo is a software development company, established in 2006. They are headquartered in Yerevan, Armenia and have a second location in Zaporizhia, Ukraine. Volo has a large team of 130 employees; they specialize in mobile app development, custom software development, and cybersecurity. They mostly work with enterprise level clients in the financial services, telecommunications, and health care sectors.",5.0,(8 Reviews),SharkNinja; Jabil; FLYR; MTS,An insurance consulting firm hired Volo to develop a compliance application using ASP.NET MVC. The app serves as a niche project management tool for insurance companies.,"['Business services', 'Consumer products & services', 'Education', 'Financial services', 'Government', 'Medical']","Yerevan, Armenia",250 - 999 employees,"$25,000+"
HQSoftware,internet-of-things,"HQSoftware is a software development company with offices in Estonia, the United States, and Belarus. The team of under 250 specializes in IoT development, AR/VR development, web development, and mobile app development. Founded in 2001, the firm solves problems like limited budgets and inadequate offshoring options by designing apps that align with business needs and ideas. By focusing on every aspect of IoT ecosystems above low-level programming for hardware, HQSoftware offers clients new product and service opportunities. HQSoftware develops technical solutions to improve clients' customer experience, create new revenue streams, and drive traffic. ",4.9,(18 Reviews),Skoda; Bell; Sega; HTC,A fintech company contracted HQSoftware for staff augmentation services. The team is responsible for scaling the client's development team to achieve their milestones in a timely manner.,"['Automotive', 'eCommerce', 'Education', 'Financial services', 'Medical', 'Information technology', 'Manufacturing', 'Telecommunications']","Tallinn, Estonia",50 - 249 employees,"$10,000+"
Order Group,internet-of-things,"Order Group is a custom software company, founded in 2014 and located in Warsaw, Poland. They comprise 28 employees specializing in delivering advanced IT systems, web and mobile apps, product design and tech consulting workshops. They work with startups and global corporations.",5.0,(18 Reviews),,"Order Group designed the UI and UX for a web-hosted business administration app. Based on computer sketches and written descriptions, they created a demo using InVision. They now help plan new features.","['Consumer products & services', 'Financial services', 'Medical', 'Energy & natural resources']","Warszawa, Poland",10 - 49 employees,"$25,000+"
Apriorit,internet-of-things,"Apriorit is a software product engineering company founded in 2002 with offices in Dover, Del., and Budapest, Hungary. Apriorit boasts a team of more than 200 employees who are well-versed in custom software development, web development, and mobile app development. ",4.9,(28 Reviews),Fortune 500 security solution vendors; Fortune 500 virtualization technology vendors; SaaS solution providers (CRM; HR,"A customer identity and access management company was looking to present the benefits of their software seamlessly, so they hired Apriorit for web development. The team utilized React and OpenID in the build.","['Automotive', 'Business services', 'Financial services', 'Medical', 'Information technology']","Wilmington, DE",250 - 999 employees,Undisclosed
DAC.digital,internet-of-things,"DAC.digital is an IT service provider in Gdańsk, Poland. Their team of fewer than 50 employees offers services in IoT development, blockchain, big data consulting, and custom software development. They services midmarket and enterprise companies in industries such as transportation, IT, and energy and natural resources. They were founded in 2009.",4.9,(8 Reviews),eye square GmbH; Sports Computing AS; Snowfall Travel (Junction Pay Limited); ABAX AS,"DAC.digital provides custom software development and consulting services for an IT firm. They work together with the client on multiple projects that involve various key technologies, such as Kotlin and React.","['Advertising & marketing', 'Arts, entertainment & music', 'Automotive', 'Business services', 'Consumer products & services', 'eCommerce', 'Financial services', 'GPS, Navigation & GIS', 'Medical', 'Manufacturing']","Gdańsk, Poland",50 - 249 employees,"$10,000+"
Dogtown Media,internet-of-things,"Located in Venice Beach, Calif., Dogtown Media specializes in app development, artificial intelligence, and UI/UX design for clients in the health care and financial services industries. With an additional office in San Francisco, the company, founded in 2011, has a team of around 30 who have helped launch 100+ apps for startups and Fortune 500 companies.",4.9,(29 Reviews),Google; Lexus; United Nations; CitiBank,"Dogtown Media built a generic app for presentation purposes, then later modified and refined the app based on customer needs.","['Financial services', 'Medical']","Los Angeles, CA",10 - 49 employees,"$25,000+"
Matellio,internet-of-things,"Matellio is a mobile and web app development company founded in 2012. Headquartered in San Jose, Calif., Matellio's team of around 40 specialize in web and mobile app development.Although Matellio encountered unexpected challenges that led to minor delays, the client appreciated their clear communication.",4.8,(36 Reviews),Startups; Fortune 500 Companies; Entrepreneurs; SMBs,"Matellio provides mobile app development services for a financial literacy startup. They’ve built an iOS and Android version of the app, along with an online portal to manage it.","['Business services', 'Information technology', 'Retail']","San Jose, CA",50 - 249 employees,"$10,000+"
