company_name,category,description,overall_rating,review_count,clients,notable_project,industries,location,company_size,min_project_size
Cledar,internet-of-things,"Cledar is an AI company launched in 2011. Their small team is based in Corte Madera, California. Their services include Artificial Intelligence, custom software development, BI & big data consulting & SI, cloud consulting & SI, and more.",5.0,(4 Reviews),,"Cledar's team was responsible for various development projects of a digital footprint collector, including data loaders, ETL algorithms, and UI/UX designs. They also developed a web and mobile app on React.","['eCommerce', 'Financial services', 'Government', 'Information technology', 'Supply Chain, Logistics, and Transport']","Corte Madera, CA",10 - 49 employees,"$25,000+"
BigOVenture,internet-of-things,"BigOVenture is a mobile application development company. They are based in Karachi, Pakistan and have a small team. Their services include mobile app development, wearable app development, IoT development, and other application development.",4.8,(5 Reviews),,BigOVenture was hired by an internet service provider to develop a customer service mobile and desktop app for the client's internal team. They used Google Firebase and Twillio to develop the app.,['Information technology'],"Karachi, Pakistan",2 - 9 employees,"$5,000+"
ZETRIXWEB INFOTECH LLP,internet-of-things,"Founded in 2015, ZETRIXWEB INFOTECH LLP is a development firm. Their team of around 15 employees is based in Ahmedabad, India. They focus on mobile app development, UX/UI design, and IoT development.",4.9,(4 Reviews),Key clients: We've served more than 500 clients across the globe of all sizes. Some of our key enterprise companies we've worked - PhoneWale; Pinkoo; IndiaTok. To know more - see our here - https://zetrixweb.com/mobile-application-development/ (link is external).,Zetrixweb Infotech LLP developed an iOS and Android mobile application for COVID-19 contact tracing. They used Swift and Kotlin. ,,"Ahmedabad, India",10 - 49 employees,"$1,000+"
KodeGlobe Technologies,internet-of-things,"KodeGlobe Technologies is an app development company. The small New Delhi, India-based company was founded in 2017. Their team specializes in mobile app development, web design, AR/VR development, blockchain, and more.",5.0,(7 Reviews),,KodeGlobe Technologies provided app development. Their team built a unique app and supplied front- and backend work. ,"['Business services', 'Consumer products & services', 'eCommerce', 'Education', 'Financial services', 'Medical', 'Hospitality & leisure', 'Real estate']","New Delhi, India",10 - 49 employees,"$1,000+"
Develonica Inc.,internet-of-things,"Aplana Software is a custom software development company headquartered in Huntingdon Valley, Pa. The company also has locations in Moscow, Manchester, UK, and Offenbach, Germany. It was founded in 1999 and now employs 150 people who specialize in cloud consulting & SI, blockchain, and custom software development. Aplana Software's clients vary greatly in size and industry.",4.9,(4 Reviews),Aeroflot; Amadeus Group; BP; Citation,Aplana built a complex platform that collects data from multiple sources and automatically compiles the information into reports. They continue to provide web development across multiple projects.,"['Business services', 'Financial services', 'Medical', 'Hospitality & leisure', 'Information technology', 'Manufacturing', 'Retail', 'Telecommunications', 'Supply Chain, Logistics, and Transport']","Huntingdon Valley, PA",250 - 999 employees,"$25,000+"
Orax Technologies Ltd,internet-of-things,"Founded in 2015, Orax Technologies is a development firm. Their team of around 5 employees is based in Lahore, Pakistan. They focus on web development, e-commerce development, and marketing strategy.",4.7,(3 Reviews),Rounne,Orax Technologies engaged in two-model mobile app development in one application for a hospitality company. The main idea revolves around connecting workers and work providers to meet and hire each other.,"['Business services', 'eCommerce', 'Education', 'Medical', 'Information technology']","London, United Kingdom",10 - 49 employees,"$5,000+"
Appsnation,internet-of-things,,,,,,"['Business services', 'eCommerce', 'Gaming', 'Government', 'Medical', 'Media', 'Real estate']","Los Angeles, CA",10 - 49 employees,"$1,000+"
ADUK GmbH,internet-of-things,,,,,,"['GPS, Navigation & GIS', 'Medical', 'Information technology', 'Manufacturing']","Planegg, Germany",10 - 49 employees,"$5,000+"
Peakboard GmbH,internet-of-things,,,,,,"['Automotive', 'Medical', 'Manufacturing', 'Supply Chain, Logistics, and Transport']","Stuttgart, Germany",10 - 49 employees,Undisclosed
Mobter,internet-of-things,"Mobter is a mobile software development company based in Warsaw. Founded in 2012, the team of 17 specializes in mobile app development, UX/UI design, and web development. They work primarily with small business clients, mainly in the business services industry. ",5.0,(3 Reviews),Euro Bank; Certum; Medicover,"Mobter designed, developed, tested, and now work on the maintenance of an iOS and Android mobile banking application. They continue to add functionalities and fix any issues or bugs.",['Financial services'],"Warszawa, Poland",2 - 9 employees,"$1,000+"
SoftProdukt,internet-of-things,"SoftProdukt is a software engineering company located in Denver. Founded in 1986, they currently have about 8 employees. They provide web, custom software, and IoT development services to midmarket firms and small businesses in government, financial services, and the gambling industry. ",5.0,(3 Reviews),Central Mining Institute; KONAR,SoftProdukt provides Django and Python development services for a data analytics company. Their work ranges from UI to the technical details of working with data.,"['eCommerce', 'Education', 'Financial services', 'Gambling', 'Government', 'Manufacturing']","Denver, CO",10 - 49 employees,"$5,000+"
Alvi Software Pvt. Ltd.,internet-of-things,"Alvi Corporation, a software development company, was launched in 2018. The company specializes in custom software development, other application development, e-commerce development, IoT development, and more and has a small team.",4.8,(3 Reviews),,Alvi Corporation provided custom software development for a nonprofit organization. The team developed an online platform that delivered qualitative assessments.,"['Business services', 'eCommerce', 'Education', 'Financial services', 'Medical', 'Real estate', 'Retail', 'Utilities']","Ahmedabad, India",10 - 49 employees,"$1,000+"
GEOGO Techsolutions,internet-of-things,"GEOGO Techsolutions is a small software development firm founded in 2014. Their team offers custom software development, cloud consulting & SI, IoT development, mobile app development, and more. The firm is in Bengaluru, India.",4.5,(3 Reviews),,GEOGO Techsolutions has been in charge of the server and system architecture of a mobility solutions company for five years. They’ve also aided in the development of the iOS version of an app.,"['Automotive', 'Business services', 'Education', 'GPS, Navigation & GIS', 'Information technology', 'Manufacturing', 'Supply Chain, Logistics, and Transport', 'Utilities']","Bengaluru, India",10 - 49 employees,"$1,000+"
Jungsoft,internet-of-things,"Jungsoft is a software consulting and development company based in Berlin with an office in Florianópolis, Brazil. The company, founded in 2019, has a team of more than ten that provides web development, mobile app development, IoT development, enterprise app modernization, and other application development services. Jungsoft serves small and larger-sized companies in various industries that include financial services, e-commerce, and business services.",5.0,(2 Reviews),Rolls-Royce,"A software company engaged with Jungsoft for app development and design. The key project steps include backend processing, generating a tracking system, implementing a reporting module, and system integration.","['Business services', 'eCommerce', 'Financial services', 'Information technology']","Berlin, Germany",10 - 49 employees,"$25,000+"
FOXBEGIN,internet-of-things,"FOXBEGIN is a software development company. Their midsize team is located in London, United Kingdom. Their services include custom software development, mobile app development, search engine optimization, ux/ui design, and more. The firm was established in 2020.",5.0,(1 Reviews),,An education platform collaborates with FOXBEGIN to develop a mobile app that will enable private tutors to track students and communicate with parents better. They create the wireframes and graphic design.,"['Advertising & marketing', 'Arts, entertainment & music', 'Automotive', 'Business services', 'Consumer products & services', 'eCommerce', 'Education', 'GPS, Navigation & GIS', 'Medical', 'Hospitality & leisure']","London, United Kingdom",50 - 249 employees,"$10,000+"
ARC Software,internet-of-things,"ARC Software is a small software development firm. Founded in 2017, the company is headquartered in Wrocław, Poland and Oslo, Norway. Their team provides custom software development, mobile app development, web development, and IoT development.",5.0,(1 Reviews),,ARC Software developed custom software for a marketing agency. They built the software that supported marketing activities such as data collection and customer traction in different channels. ,"['eCommerce', 'Information technology']","Wrocław, Poland",10 - 49 employees,"$5,000+"
The Awesome Company,internet-of-things,"Founded in 2010, The Awesome Company is located in Kharkiv, Ukraine. With 25 employees, they provide mobile app development, web development, and custom software development services for midmarket and small businesses.",5.0,(3 Reviews),Geeksterink; WineLiker; Notate,"After resolving a previous developer’s errors, The Awesome Company built out an iOS and Android app that sends unique videos and information each week. They instated compatibility for new Apple updates. ","['Business services', 'eCommerce', 'Education', 'Financial services', 'Medical']","Kharkiv, Ukraine",10 - 49 employees,"$5,000+"
Hey Machine Learning,internet-of-things,"Hey Machine Learning is an AI company headquartered in Kharkhov, Ukraine with an additional office in Wilmington, Del. They were founded in 2017, and they now work with a team of 12 employees. In addition to AI, they also provide custom software development and IoT development to their clients.
 ",5.0,(2 Reviews),TERA Informática; Jetson Nano; Movieterra,Hey Machine Learning built computer vision (CV) algorithms to broaden the capabilities of fire detection software.,,"Kharkiv, Ukraine",10 - 49 employees,"$10,000+"
Golux Technologies,internet-of-things,"Golux Technologies is a web development agency based in Belgrade, Serbia with a team of 25 professionals. Since 2015, the company has offered web development, digital strategy, and branding assistance to clients. They use languages such as JavaScript and Ruby, with frameworks such as NodeJS and Ruby on Rails.",5.0,(1 Reviews),MomentVM; Ryfi; Elektronik Partner; Lucid,"Golux has provided outsourced web development assistance for a series of projects. They developed a website and offered staff augmentation for builds utilizing Laravel PHP and React.js, among other technology.",,"Beograd, Serbia",10 - 49 employees,"$25,000+"
Venovis,internet-of-things,"Headquartered in Port Coquitlam, Canada, Venovis is a digital solutions company with a small team of four. Since 2008, their team has been delivering mobile app development, AI, custom software development, and IoT development services. ",5.0,(1 Reviews),Dynamic Structures; The Green Channel; TrioTech; Black Pixel,"An online streaming service hired Venovis for multiple app development projects. The team works with iOS, Android, and other application types. They also assist with upgrades between major app launches. ",,"Port Coquitlam, Canada",2 - 9 employees,"$25,000+"
ADESTECH,internet-of-things,"ADES Technologies is a program development agency founded in 2010 run by a team of 8. Based in Monterrey, Mexico, the company specializes in web, IoT, and mobile app development for small midmarket businesses. They have experience working in the business services, consumer products & services, and IT industries. They are also proficient in developing wearable apps for Apple Watch, Android watches, and other wearables.",4.9,(4 Reviews),gigaaa; Home Depot; Mouser Electronics; Swarovski,"ADES Technologies provided e-commerce development services for a health and wellness brand. Their team built a WooComerce site that features the partner's products, information, and routines.","['Consumer products & services', 'eCommerce', 'Information technology']","Monterrey, Mexico",10 - 49 employees,"$1,000+"
Varfix,internet-of-things,"Based in Toronto, Canada, Varfix is a data analytics company. They specialize in BI & big data consulting & SI, cloud consulting & SI, custom software development, AR/VR development, and more and were founded in 2015.",5.0,(1 Reviews),,"Varfix designs and develops web apps for an IT services company. The apps are built using C# and hosted on Azure. Additionally, some apps have integrations with Microsoft Dynamics CRM.","['Advertising & marketing', 'Business services', 'Education', 'Financial services', 'Medical', 'Information technology', 'Legal', 'Media', 'Energy & natural resources', 'Telecommunications']","Toronto, Canada",2 - 9 employees,"$1,000+"
Skillforce.pl Sp. z o.o.,internet-of-things,"Skillforce.pl Sp. z o.o. is an AI firm based in Gliwice, Poland. Founded in 2017, their team of 30 serves clients in the transportation, IT, and manufacturing sectors. Services include IoT development and custom software development.",4.0,(2 Reviews),,Skillforce.pl Sp. z o.o. developed a backend solution for both Android and iOS devices. They coded in Kotlin and MySQL.,"['Automotive', 'Medical', 'Information technology', 'Manufacturing', 'Retail', 'Supply Chain, Logistics, and Transport']","Gliwice, Poland",10 - 49 employees,"$1,000+"
Axellero,internet-of-things,"Axellero is a software development company that was founded in 2010. The company has less than 10 employees and is headquartered in New York with another location in Toronto. They specialize in custom software development, mobile app development, and web development. 
 ",5.0,(3 Reviews),Nikon; T-Mobile; Jeep; Liberty Mutual,"Axellero provided web and mobile application development, working on a complex native iOS and Android system using PHP, Python, and several databases. They included GPS tracking and third-party integrations.","['Automotive', 'GPS, Navigation & GIS', 'Information technology', 'Supply Chain, Logistics, and Transport']","New York, NY",50 - 249 employees,"$5,000+"
Acentria Software,internet-of-things,"Acentria Software is a software development company in Jaipur, India that was founded in 2012. Their small team of 4 employees offers services in mobile app development, e-commerce development, and artificial intelligence. They mainly work with mid-market and small businesses in transportation, health care and medicine, and consumer products and services industries.",5.0,(3 Reviews),Xandro; Jesus House Birmingham; Lions Clubs; Boost Monster,"Acentria Software updated existing websites, adding new features such as comprehensive search functionalities and advanced security. They designed and developed WordPress sites, making them more functional.","['Consumer products & services', 'eCommerce', 'Education', 'Financial services', 'Gaming', 'Medical', 'Real estate', 'Retail', 'Supply Chain, Logistics, and Transport']","Jaipur, India",50 - 249 employees,"$1,000+"
Apptware,internet-of-things,"Apptware is a custom web & mobile application development and design company based in Pune, India, with an office in Toronto. The company, founded in 2019, has more than 60 employees and provides web development, UX/UI design, and custom software development services to small and midmarket IT companies. ",5.0,(1 Reviews),KEY Travel Concierge; Bajaj Finserv; CertusOHS; Foxberry Technologies,Apptware manages the UI of a web-based data governance application. Their services have included visual design and the development of features that display backend data.,['Information technology'],"Pune, India",50 - 249 employees,"$5,000+"
Pyzen Technologies,internet-of-things,"Pyzen Technologies is a custom software development company. They are located in Gurugram, India and have a small team. The firm provides custom software development, e-commerce development, IoT development, mobile app development, and more.",4.0,(1 Reviews),,"Pyzen Technologies developed a Python-based web app for a startup company. It was based on healthcare industry changes, requiring Firebase as an API to pull patient data for insurance companies.",,"Gurugram, India",10 - 49 employees,"$1,000+"
ARRAIGN TECHNOLOGIES PVT LTD,internet-of-things,"ARRAIGN TECHNOLOGIES PVT LTD is a development agency founded in 2018 with no more than 50 professionals. Based in Bangalore, India, they offer custom software, web, and mobile app development solutions to clients across various industries.",4.0,(3 Reviews),Cohora; Lybr,ARRAIGN TECHNOLOGIES PVT LTD acted as a consultant on the development of a bespoke community and marketing SaaS platform. They worked on enhancing the product to make it more user-centric.,"['Consumer products & services', 'eCommerce', 'Education', 'GPS, Navigation & GIS', 'Medical', 'Information technology', 'Manufacturing', 'Real estate', 'Supply Chain, Logistics, and Transport']","Bengaluru, India",10 - 49 employees,"$5,000+"
R2Consulting,internet-of-things,"Web design company R2Consulting was established in 2016. The company specializes in web design, ux/ui design, cloud consulting & SI, IT managed services, and more and has a small team.",5.0,(1 Reviews),,"R2Consulting has worked on full stack development projects for a software development company. They’ve built a website, created dashboards and front interfaces, and provided SEO services.",,"Boulder, CO",10 - 49 employees,"$1,000+"
Magnatesage Technologies,internet-of-things,"Magnatesage Technologies is a mobile app development company founded in 2009 and located in Ahmedabad, India. The team of fewer than 50 employees offers mobile and wearable app development services, as well as enterprise app modernization services. Their clientele is composed primarily of enterprises in the education, financial services, and transportation industries.",4.8,(4 Reviews),AishFi Chat App; PokketKash App; Forsendo App,Magnates Technologies is producing mobile applications for market research purposes by taking existing designs and wireframes and providing coding.,"['Arts, entertainment & music', 'Business services', 'Education', 'Financial services', 'Gaming', 'Retail', 'Supply Chain, Logistics, and Transport']","Ahmedabad, India",10 - 49 employees,"$5,000+"
byPeople Technologies,internet-of-things,"Founded in 2011, byPeople Technologies is a software and web development company based in Gold Coast, Australia. This team of 67 provides custom software development, mobile app development, web development, web design, IoT development, and digital marketing services.",4.9,(5 Reviews),Tech Mahindra; Intel; Nayara; Adani,"byPeople Technologies works on design and development, focusing on a range of iOS, Android, and web applications. They use various technologies for the builds and have developed the accompanying websites too.   ",,"Robina, Australia",50 - 249 employees,"$10,000+"
MENA Software,internet-of-things,"MENA Software was founded in 2012 in Sofia, Bulgaria. It now has 21 employees providing services in blockchain, non-voice BPO/back office services, and BI & big data consulting & SI.They mainly work in the information technology, business services, and financial services industries.",4.8,(4 Reviews),StanVision; Cryptoken Media; List a Token,MENA Software helped develop a blockchain software solution from scratch.,"['Business services', 'Consumer products & services', 'Financial services', 'Gambling', 'Gaming', 'Information technology']","Sofia, Bulgaria",10 - 49 employees,"$5,000+"
PineDev Studio,internet-of-things,"PineDev Studio is a website and mobile app development agency, founded in 2014 and located in Kharkiv, Ukraine. They comprise nine employees specializing in the design, development, validation, and support of websites and mobile applications. They work with a range of global companies, utilizing a variety of technology, including Adobe, PHP, Fabric, and Bootstrap.",4.9,(5 Reviews),Trycka; Canvas Picasso; Consilience Media; Deso,"PineDev Studio was responsible for developing a website for an immigration law practice. Starting from scratch, they built a platform to be accessed by clients to chat with agents and complete online payments.",,"Kharkiv, Ukraine",10 - 49 employees,"$5,000+"
MOVO Creations,internet-of-things,"MOVO Creations is a software provider headquartered in Gdansk, Poland. Founded in 2014, they have an additional office in Malmo, Sweden. Their team of approximately 4–5 employees primarily served midmarket clients in the IT and consumer goods sectors. Along with custom software, they also provide web, mobile, e-commerce, and IoT development.",4.8,(2 Reviews),Spar Nord; Beru; Petra; iPaper,MOVO provides staff augmentation to the backend development team of a web developer for government ministries. Their members integrated into the team directly and work primarily in .NET.,"['Business services', 'Consumer products & services', 'eCommerce', 'Medical', 'Information technology', 'Energy & natural resources']","Gdańsk, Poland",10 - 49 employees,Undisclosed
Prostir,internet-of-things,"Founded in 2017, Prostir is a development firm. Their team of around 10 employees is based in Tallinn, Estonia, with an additional office in Kyiv, Ukraine. They focus on custom software development, big data consulting, and cybersecurity.",5.0,(1 Reviews),BSG; Mobirich; Testelium; Insfero,"Prostir built a software solution to automate legal document and report creation for a law firm. After scoping the project, they conducted end-to-end development with weekly feedback. The project is ongoing.",,"Tallinn, Estonia",2 - 9 employees,"$10,000+"
Virtusai,internet-of-things,"Virtusai is a technology startup based in Porto, Portugal. Founded in 2015, Virtusai has a team of about 10 specialists that focuses on web development, mobile app development, and IoT development services.",4.0,(1 Reviews),Frulact SA; Super Bock Group SA; Sonae SA; Enforce SA,"Virtusai analyzed an existing application and created a new web-based version in Angular. The updated platform is mobile friendly, with a variety of new tools that improve functionality.",,"Porto, Portugal",2 - 9 employees,"$1,000+"
ASTRALBYTE,internet-of-things,,,,,,"['Advertising & marketing', 'Consumer products & services', 'Dental', 'Financial services', 'Medical', 'Hospitality & leisure', 'Information technology', 'Media', 'Telecommunications', 'Utilities']","București, Romania",2 - 9 employees,"$10,000+"
Dotcom IoT LLP.,internet-of-things,,,,,,"['GPS, Navigation & GIS', 'Medical', 'Information technology', 'Manufacturing']","Mumbai, India",50 - 249 employees,"$5,000+"
Jet.Dev,internet-of-things,"Jet.Dev is a web development company. The small Myrhorod, Ukraine-based team focuses on web development, custom software development, and IoT development. The firm was launched in 2016.",5.0,(1 Reviews),,"An online article database tapped Jet.Dev to customize Drupal and implement Open Social. They designed and integrated various custom modules, such as languages, workflows, and other client-requested functions.","['Advertising & marketing', 'Business services', 'Education', 'Medical', 'Media']","Myrhorod, Ukraine",10 - 49 employees,"$5,000+"
HCL Technologies (Shanghai) Limited,internet-of-things,"Cybersecurity company HCL Technologies (Shanghai) Limited is based in Shanghai, China. Founded in 2007, the midsize team provides cybersecurity, cloud consulting & SI, IT managed services, IT strategy consulting, and more.",4.0,(1 Reviews),,"A global engineering manufacturer was looking to improve their workforce and sales processes, so they engaged with HCL Technologies to implement Salesforce into their system and operations.","['Automotive', 'Consumer products & services', 'Medical', 'Energy & natural resources', 'Utilities']","Shanghai, China",50 - 249 employees,Undisclosed
Infologics,internet-of-things,,5.0,(1 Reviews),,"Infologics integrated blockchain into a game development company's platforms. They included tokenomics, wallet integrations, and smart contracts.","['Advertising & marketing', 'Arts, entertainment & music', 'Automotive', 'Dental', 'eCommerce', 'Education', 'Financial services', 'Medical', 'Information technology', 'Telecommunications']","Lahore, Pakistan",10 - 49 employees,"$10,000+"
Envoy,internet-of-things,,,,,,"['Advertising & marketing', 'Business services', 'Consumer products & services', 'eCommerce']","Irvine, CA",50 - 249 employees,"$100,000+"
Kryptoninc Infolab LLP,internet-of-things,,4.9,(4 Reviews),,Kryptoninc Infolab LLP developed a mobile app and a web-based system for an alarm systems provider. The team provided a roadmap before developing the solutions and integrating them into the client's hardware.,"['Business services', 'eCommerce', 'Education', 'Financial services', 'Gaming', 'Medical', 'Information technology']","Ahmedabad, India",10 - 49 employees,"$1,000+"
