company_name,category,description,overall_rating,review_count,clients,notable_project,industries,location,company_size,min_project_size
Evergreen,internet-of-things,"Evergreen is a business solutions developer based in Kiev, Ukraine. Founded in 2009, their team of about 20 works mainly with mid-market clients in a variety of industries. They specialize in web development, custom software development, IoT development, AI development, and UX/UI design.",4.8,(19 Reviews),Mindcruncher; Baldinelli; Unisender,Evergreen developed two websites to create a more professional presence for a translation services company and to market their software product. They have also designed promotional marketing materials.,"['Advertising & marketing', 'Consumer products & services', 'eCommerce', 'Education', 'Financial services', 'Government', 'Medical', 'Information technology']","Kyiv, Ukraine",10 - 49 employees,"$10,000+"
Alora Labs,internet-of-things,"Alora Labs is a boutique development agency founded in 2018 with fewer than 10 professionals. They offer custom software development, IoT development, and UX/UI design solutions from their office in Markham, Canada.",5.0,(1 Reviews),Mero; Objex; Banana Accounting; Rosterpoint Hockey,"Alora Labs built an MVP for a data analytics firm. Their work included consultation, hardware design, and analytics dashboard development.","['Business services', 'Consumer products & services', 'eCommerce', 'Education', 'Government', 'Medical', 'Information technology', 'Manufacturing', 'Media']","Markham, Canada",2 - 9 employees,"$25,000+"
SHIP IT Inc.,internet-of-things,"Custom software development firm SHIP IT Inc. Is headquartered in Washington, District of Columbia. They provide custom software development, mobile app development, ux/ui design, and IoT development and were launched in 2022.",5.0,(4 Reviews),,"SHIP IT Inc. developed a cross-platform mobile app for a fitness safety company. They used the client's existing wireframes to rebuild the app from scratch using Flutter, Firebase, App Radar, and other tools.","['Advertising & marketing', 'Arts, entertainment & music', 'Business services', 'Education', 'GPS, Navigation & GIS', 'Medical', 'Manufacturing', 'Media', 'Energy & natural resources', 'Non-profit']","Washington, DC",2 - 9 employees,"$50,000+"
Chirp Technologies,internet-of-things,"SEO agency Chirp Technologies was launched in 2018. Their small team is headquartered in Philadelphia, Pennsylvania and Lahore, Pakistan. Chirp Technologies offers search engine optimization, mobile & app marketing, e-commerce development, custom software development, and more.",5.0,(3 Reviews),,"Chirp Technologies developed a mobile app for an IoT product and design services firm. The development involved interfacing hardware devices over BLE, providing user-friendly UI, and cloud-connecting.","['Advertising & marketing', 'Business services', 'eCommerce', 'Gaming', 'Information technology', 'Telecommunications']","Philadelphia, PA",10 - 49 employees,"$1,000+"
REZET,internet-of-things,"ReZet is a software development company based in Zaporizhzhya, Ukraine. The company, founded in 2017, has around 40 employees and provides web development, custom software development, e-commerce development, enterprise app modernization, application testing, and other application development services. ReZet serves small and mid-market companies in various industries that include business services, advertising & marketing, and arts & entertainment.",5.0,(6 Reviews),Henry Smith; Bilal Succar,A management consulting company partnered with ReZet to develop custom software. This is expected to help the client in recruiting and managing their development staff.,"['Business services', 'eCommerce', 'Education', 'Financial services', 'Medical', 'Information technology', 'Media', 'Real estate']","Zaporizhzhia, Ukraine",50 - 249 employees,"$5,000+"
Nolt technologies,internet-of-things,"Founded in 2013, Nolt technologies is a development firm. Their team of around 10 employees is based in Khmelnytskyi, Ukraine. They focus on custom software, e-commerce, and mobile app development.",4.8,(3 Reviews),,"Nolt technologies was hired by a software, mobile, and web development provider to help support them through a particular app development project. The team used Xamarin and .NET.","['Business services', 'eCommerce', 'Financial services', 'Manufacturing', 'Energy & natural resources']","Khmel'nyts'kyi, Ukraine",10 - 49 employees,"$25,000+"
RedCat Ltd,internet-of-things,"Resty-app is a mobile app development firm based in Kharkiv, Ukraine. Founded in 2018 ,their team of 20 serves clients in the business services, healthcare, and hospitality sectors. Services include iOS/Android, React Native, NodeJS, and JavaScript development.",5.0,(10 Reviews),Ubicar; SizeID; Fincor; Slipshure,"RedCat Ltd built a mobile application for an LMS platform. The project scope included exploring ideas and solutions, defining key features and user roles, and developing wireframes and designs.","['Arts, entertainment & music', 'Business services', 'Consumer products & services', 'eCommerce', 'Medical', 'Hospitality & leisure', 'Information technology', 'Non-profit', 'Retail', 'Supply Chain, Logistics, and Transport']","Kharkiv, Ukraine",10 - 49 employees,"$25,000+"
Pixium Digital Pte Ltd,internet-of-things,"Pixium Digital Pte Ltd is a website development firm headquartered in Singapore, Singapore and Paris, France. The small company was launched in 2015. Their team specializes in web development, mobile app development, IoT development, and AR/VR development.",4.8,(2 Reviews),,Pixium Digital Pte Ltd is developing a backend and mobile app for a live sports social platform. They've built the app and are now in live testing.,['Information technology'],"Singapore, Singapore",10 - 49 employees,"$10,000+"
DuckMa,internet-of-things,"Mobile application development company DuckMa is located in Rezzato, Italy. The small team specializes in mobile app development, IoT development, and mobile & app marketing. The company was launched in 2013.",,,,,"['Advertising & marketing', 'Business services', 'Consumer products & services', 'Medical', 'Information technology', 'Manufacturing', 'Media', 'Non-profit', 'Utilities']","Rezzato, Italy",10 - 49 employees,"$25,000+"
Opengenica,internet-of-things,"Opengenica is a boutique IoT company based in Redwood City, Calif. The company, founded in 2013, has a team of less than ten that provides IoT development services to various companies and institutions in the consumer products and services, transportation, and utilities industries.",5.0,(3 Reviews),BlackBerry; QNX; 3D Ponics,Opengenica redesigned and developed two web portals: one for veteran appreciation and another for government-based financial support. Both were based on Kentico CMS with JavaScript and Microsoft technologies.,"['Consumer products & services', 'Supply Chain, Logistics, and Transport', 'Utilities']","Redwood City, CA",10 - 49 employees,"$25,000+"
TVS Next Private Limited,internet-of-things,"TVS Next Private Limited is a technology solutions and services provider headquartered in New York City, with an office in India. Founded in 2008, the team of 185 specializes in custom software development, UX/UI design, and loT development. They primarily serve health care and medical, and information technology clients.  ",5.0,(2 Reviews),Pharma Point; eXact Learning Solutions; Sundaram Fastners Limited; ,"[Blisslogix was acquired by TVS Next Private Limited, this project was completed prior to acquisition]","['Automotive', 'Business services', 'Consumer products & services', 'Education', 'Financial services', 'Medical', 'Information technology', 'Manufacturing', 'Supply Chain, Logistics, and Transport']","New York, NY",250 - 999 employees,"$10,000+"
SISGAIN,internet-of-things,"SISGAIN is a small app development firm based in Noida, India. The team provides mobile app development, web design, and web development.",4.7,(3 Reviews),,Sisgain was hired by a digital and mobile tech consulting services company for mobile app development. They built a highly versatile and user-friendly pet care mobile app.,"['Dental', 'eCommerce', 'Education', 'Financial services', 'Medical', 'Hospitality & leisure']","Toronto, Canada",50 - 249 employees,"$10,000+"
Sdreatech,internet-of-things,"Sdreatech is an IT firm founded in 2019 in Mumbai, India. Their team of more than 10 specializes in IoT, web, and mobile app development solutions for clients that work in the industries of IT solutions, consumer products, and business services.",5.0,(5 Reviews),Shaypes Fitness and Nutrition LLP; Heroine Hair Salon; Heroine Hair Salon,Sdreatech developed custom software for a weight loss and wellness company. The team created booking and management software to help the client process clients faster.,"['Arts, entertainment & music', 'Automotive', 'Business services', 'Consumer products & services', 'Education', 'GPS, Navigation & GIS', 'Medical', 'Information technology', 'Energy & natural resources', 'Supply Chain, Logistics, and Transport']","Mumbai, India",10 - 49 employees,"$5,000+"
Aeliasoft,internet-of-things,"Aeliasoft is a software agency based in Ramallah, Palestinian Territory and founded in 2015. With no more than 50 employees, they offer IT staff augmentation, custom software development, and IoT development solutions to small businesses.",4.9,(5 Reviews),Mashvisor; One Clique Systems FZ-LLC; DSM SOLUTIONS LTD,Aeliasoft developed a web-based module. Functionalities included the ability to create letter templates and send notifications. ,"['Consumer products & services', 'eCommerce', 'Medical', 'Information technology', 'Real estate']","Ramallah, Palestine, State of",10 - 49 employees,"$10,000+"
ownAI Solutions,internet-of-things,"OwnAI Solutions is a website development company based in Rajkot, India. The small agency was established in 2019. Their team offers web development, e-commerce development, custom software development, IoT development, and more.",5.0,(2 Reviews),CloudExt; Simply BOTS; Indigu,"ownAI Solutions was hired by an education firm for web development services. They completed the development of a learning management system using MongoDB, Express.js, Angular, and Node.js.","['Business services', 'Consumer products & services', 'eCommerce', 'Education', 'Financial services', 'Hospitality & leisure', 'Manufacturing', 'Telecommunications', 'Supply Chain, Logistics, and Transport']","Rajkot, India",10 - 49 employees,"$5,000+"
Software Associates,internet-of-things,"Founded in 1991, Software Associates is a web application developer building e-commerce portals, social media websites, intranets, and extranets. Their team of 100 employees is headquartered in Kerala, India. Their services include web development, mobile app development, and IoT development for enterprise, midmarket, and small businesses.",4.5,(3 Reviews),MasterCard; HP; Microsoft; Asia-Pacific Breweries,"Software Associates provided outsourced software development. They rebuilt the code, enhanced systems, and integrated third-party apps. ","['Advertising & marketing', 'Business services', 'GPS, Navigation & GIS', 'Medical', 'Information technology', 'Manufacturing', 'Media', 'Energy & natural resources', 'Supply Chain, Logistics, and Transport']","Kozhikode, India",50 - 249 employees,"$1,000+"
JMMJ,internet-of-things,"JMMJ is a custom software development company based in Warsaw, Poland. Founded in 2008, they have 22 employees specializing in mobile and web technology, including AI, augmented reality, and machine learning. Working for small businesses, midmarket companies and global enterprises, they offer blockchain solutions, mobile and web app development, and Cloud control.",4.9,(4 Reviews),Microsoft; DLL Group; 7N.com; RentalButler,"JMMJ provides IT solutions and support, keeping systems running for 9 years and going strong. Some of their work includes mobile app and mobile platform development. The mobile app is for Android.","['Automotive', 'Education', 'Financial services', 'Media']","Warszawa, Poland",10 - 49 employees,"$5,000+"
Hashtaag™,internet-of-things,"Hashtaag is an app development and UX/UI design company with offices in San Francisco, Mumbai, and Bangalore, India. Founded in 2015, their team of 50 employees works with small businesses and midmarket firms in a number of industries. ",4.2,(6 Reviews),DOECards; AWAK; Open App; Paperboy,"Hashtaag fully developed the minimum viable product of the client’s app throughout the design, conceptualization and delivery stages.","['Automotive', 'Business services', 'Consumer products & services', 'eCommerce', 'Financial services', 'Government', 'Medical', 'Information technology', 'Manufacturing', 'Energy & natural resources']","Bengaluru, India",50 - 249 employees,"$25,000+"
Empeek,internet-of-things,"Empeek is a digital solutions company with offices in New York and Lviv, Ukraine. Founded in 2015, they have 59 employees specializing in the development of cross-platform apps, IoT extensions, SaaS solutions, and ERP and CRM software. They work for a variety of small businesses, midmarket companies and global enterprises, primarily in healthcare, fintech, insurance, logistics and advertising. ",4.9,(15 Reviews),MoodLifters; Pulse Drug Testing; Photopolish; Doodja,"Empeek provides ongoing development support for a healthcare tech company. They built the architecture for its flagship product, an iOS and Android app using Sigma, React, AWS, and .NET, and host the website.","['Financial services', 'Government', 'Medical', 'Information technology', 'Media', 'Non-profit', 'Telecommunications', 'Supply Chain, Logistics, and Transport']","Chicago, IL",50 - 249 employees,"$10,000+"
Senstate Technologies,internet-of-things,,5.0,(1 Reviews),,"Senstate Technologies has developed a number of solutions, including air monitoring apps and a cloud-based waste monitoring system that leverages AI and ML to alert staff when bins must be changed.","['Government', 'Information technology']","Gabrovo, Bulgaria",2 - 9 employees,"$10,000+"
MeshSoftware,internet-of-things,"MeshSoftware is a cloud consulting & SI company. They are headquartered in Arad, Romania and have a small team. Their services include cloud consulting & SI, custom software development, web development, IoT development, and more. The company was founded in 2019.",4.8,(6 Reviews),"Trade Trans Terminal, MEWI Import - Export Agrar Industrietechnik , HPA , OneSource , Cafe + Co Romania",MeshSoftware developed a coffee company’s software solution. The tool allowed vending machines to communicate with a third-party company’s system that collected money through RFID. ,"['Information technology', 'Manufacturing', 'Supply Chain, Logistics, and Transport']","Arad, Romania",2 - 9 employees,"$10,000+"
BELICHBERG,internet-of-things,,5.0,(3 Reviews),,A security service company hired Belichberg GmbH to provide custom software development. They created an AI model to detect relevant objects for the client's video security systems.,"['Information technology', 'Telecommunications', 'Supply Chain, Logistics, and Transport']","Wien, Austria",10 - 49 employees,"$5,000+"
Codana GmbH,internet-of-things,"Codana GmbH is a web development firm. They are headquartered in Heilbronn, Germany; Stuttgart, Germany and Göppingen, Germany and have a small team. Their services include web development, mobile app development, IoT development, custom software development, and more.",,,Siemens; Hochschule Heilbronn; Schunk; Schmalz,,"['Automotive', 'Education', 'Medical', 'Manufacturing', 'Energy & natural resources']","Heilbronn, Germany",10 - 49 employees,"$10,000+"
Ebryx Tech,internet-of-things,,5.0,(1 Reviews),,"Ebryx Tech provides custom software development services for a logistics company. They have built the client's website, Windows application, phone apps, and supporting applications.","['Advertising & marketing', 'Automotive', 'Education', 'Information technology', 'Media', 'Real estate', 'Retail', 'Telecommunications', 'Supply Chain, Logistics, and Transport']","Salem, NH",50 - 249 employees,"$10,000+"
code and soda,internet-of-things,"In Budapest, Hungary, code and soda is a custom software development firm. The small team specializes in custom software development, e-commerce development, web development, Artificial Intelligence, and more. The company was established in 2018.",5.0,(1 Reviews),,"Working on multiple projects for an e-grocer, code and soda designed a project plan that extended the ability for customers to credit themselves for orders and products.","['Arts, entertainment & music', 'eCommerce', 'Energy & natural resources', 'Retail']","Budapest, Hungary",10 - 49 employees,Undisclosed
Quality XP Development,internet-of-things,,5.0,(1 Reviews),,Quality XP Development developed a mobile app for a health tech company. They created the app for both Android and iOS.,"['Automotive', 'Business services', 'eCommerce', 'Medical', 'Information technology', 'Manufacturing', 'Telecommunications']","Santo Domingo, Costa Rica",10 - 49 employees,Undisclosed
IDW Innovation Studio,internet-of-things,"IDW Innovation Studio is a design and development agency based in Merida, Mexico, and founded in 2015. With over 10 experts, they offer product design, IoT development, and contract manufacturing services to small and medium-sized businesses alike.",5.0,(2 Reviews),Davis Tool Inc.; License2Innovate; Envases Universales; Promountings,"IDW Innovation Studio developed a mobile app for a smart water bottle. The team was also responsible for the concept design, mechanical, and electronics.","['Consumer products & services', 'Medical', 'Manufacturing', 'Telecommunications', 'Supply Chain, Logistics, and Transport']","Mérida, Mexico",10 - 49 employees,"$1,000+"
Ready Technology Services Inc.,internet-of-things,"Ready Technology Services Inc. Is a software development firm established in 2015. The small team offers custom software development, web development, BI & big data consulting & SI, mobile app development, and more. The firm is located in Istanbul, Turkey and Istanbul, Turkey.",5.0,(1 Reviews),,Ready Technology Services Inc. was tasked with assisting a smart retail solutions provider with selecting suitable components of a smart fridge. The project was expected to be used without embedded software.,"['Business services', 'Consumer products & services', 'eCommerce', 'Medical', 'Manufacturing', 'Retail']","Istanbul, Turkey",10 - 49 employees,"$5,000+"
iOPTIME,internet-of-things,"iOPTIME is a Salesforce consultancy and web & mobile solutions company based in Islamabad, Pakistan. The company, founded in 2012, has a team of more than ten that provides CRM consulting & SI, mobile app development, IoT development, web development, and AI services. iOPTIME serves small and mid-market companies in the IT; consumer products & services; health care & medical; education; and GPS, navigation, & GIS industries. ",4.9,(6 Reviews),TELUS Communcations; Seawin Global; doBBox,A manufacturing company hired iOPTIME to manage and customize a Salesforce admin application. The client's goal was to implement Accounting Seed for automation and increase sales and management productivity.,"['Consumer products & services', 'Education', 'GPS, Navigation & GIS', 'Medical', 'Information technology']","Islamabad, Pakistan",10 - 49 employees,"$10,000+"
Enable Startup,internet-of-things,,5.0,(4 Reviews),,"Enable Startup is in charge of development for a programming services company. They do PHP programming using Zend as a framework and jQuery, Bootstrap, and MySQL for the frontend and backend.","['Business services', 'Dental', 'eCommerce', 'Financial services', 'Medical', 'Information technology', 'Energy & natural resources', 'Telecommunications', 'Utilities']","Da Nang, Vietnam",10 - 49 employees,"$5,000+"
Treeline,internet-of-things,"Treeline Interactive is a software development company based in San Diego. Since being founded in 2004, it has grown to a team of about 54 that does IoT development, custom software development, mobile app development, and web development. Its clients are mostly midmarket and small businesses. ",4.5,(1 Reviews),Landmark Aviation; Mountain High Resort; X Games; Viacom,Treeline has helped an airline services company develop and design two separate websites using Drupal. They've also built an e-commerce website with WordPress and currently provide maintenance support.,,"San Diego, CA",10 - 49 employees,"$50,000+"
Potado,internet-of-things,"Custom software development company Potado is based in Singapore, Singapore; Kuala Lumpur, Malaysia and Sydney, Australia. They provide custom software development, web development, mobile app development, wearable app development, and more and were founded in 2019.",5.0,(2 Reviews),,"Potado utilized Figma, React, Next.js, Firebase, Node.js, and Puppeteer technologies in developing and designing a job board for an education recruitment company. They incorporated an authentication feature.",,"Singapore, Singapore",10 - 49 employees,"$5,000+"
Amar Infotech,internet-of-things,"Amar Infotech, an application development company, is based in , ; , and Ahmedabad, India. Launched in 2008, the midsize team provides mobile app development, IoT development, web development, and web design.",4.8,(3 Reviews),,"A publishing company has hired Amar Infotech for various development services and back office projects. Working in an iterative approach, they create a website and mobile application with a specific UI.","['eCommerce', 'Education', 'Financial services', 'Government', 'GPS, Navigation & GIS', 'Medical', 'Hospitality & leisure', 'Information technology']","Phoenix, AZ",50 - 249 employees,"$1,000+"
Optime,internet-of-things,,5.0,(2 Reviews),,Optime built a media processing platform for a media production company. They developed business logic and embedded firmware using JavaScript and C++.,"['Advertising & marketing', 'Automotive', 'Business services', 'Education', 'Government', 'Medical', 'Information technology', 'Telecommunications']","T'bilisi, Georgia",50 - 249 employees,"$50,000+"
SimTLiX,internet-of-things,"SimTLiX is a software agency based in Córdoba, Argentina with more than 250 members. Founded in 2014, they offer custom software development, mobile app development, and AI solutions for clients that work in the industries of media, financial services, and more.",4.8,(2 Reviews),Avaya; McAfee; Mercado Libre; Naranja,"To help the client provide online services to their customers, SimTLiX has built a web platform using Java and Flutter. They continue to work on the program.","['Automotive', 'Financial services', 'Medical', 'Telecommunications', 'Supply Chain, Logistics, and Transport']","Córdoba, Argentina",250 - 999 employees,"$25,000+"
Navyug Infosolutions,internet-of-things,"Navyug Infosolutions is an IT service company based in Noida, India with offices in Mission Vieja, Calif.; Frankfurt, Germany; and New Delhi, India. Founded in 2010, Navyug Infosolution currently has a team of about 100. They provide web development, IoT development, and mobile app development services to primarily small and mid-market businesses.",4.5,(12 Reviews),Wipro; L&T; NCR; Genability,"The client is a startup that provides a technology solution allowing banks to store and retrieve customer-related data. In order to move from the concept stage to a viable product, they needed Navyug Infosolutions to build a series of applications.","['Business services', 'Consumer products & services', 'Education', 'Financial services', 'Government', 'Medical', 'Information technology', 'Manufacturing', 'Utilities']","Noida, India",50 - 249 employees,"$5,000+"
JumpGrowth,internet-of-things,"JumpGrowth, a mobile app development firm, is in Dallas, Texas; New York, New York and Austin, Texas. The midsize team specializes in mobile app development, custom software development, enterprise app modernization, AR/VR development, and more. The company was founded in 2018.",4.7,(7 Reviews),,"JumpGrowth has modified a software algorithm company's legacy platform to meet the needs of their new product. This involved redeveloping the platform's APIs, database, AWS auto-scaling, and web app features.","['Arts, entertainment & music', 'Automotive', 'Consumer products & services', 'eCommerce', 'Education', 'Government', 'GPS, Navigation & GIS', 'Medical', 'Hospitality & leisure', 'Information technology']","Allen, TX",50 - 249 employees,"$25,000+"
websmith solutions,internet-of-things,"websmith solution is a Mumbai, India-based software development company founded in 2010. websmith solution specializes in mobile app, web, and custom software development, as well as web design.",4.7,(9 Reviews),Larsen and Tubro; Riya Travel; Dynalog India; Sterlite Technology,"Websmith built a cloud-based platform to facilitate the development of multiple iOS and Android apps for the service industry. Their work included development, testing, and deployment.","['Advertising & marketing', 'Business services', 'eCommerce', 'Education', 'Government', 'Hospitality & leisure', 'Manufacturing', 'Retail', 'Telecommunications']","Mumbai, India",10 - 49 employees,"$5,000+"
D3 Technologies Consultancy,internet-of-things,"Founded in 2018, D3 Technologies Consultancy is a development firm. Their team is based in Kalyan, India and they focus on web, IoT, and mobile app development.",5.0,(1 Reviews),Qa; Lug Meet University; Tekzop Technologies; Dental Planet,D3 Technologies Consultancy provided e-commerce development services for a consumer electronics company. The team built the WooCommerce site and provided UI/UX designs. ,"['Information technology', 'Telecommunications']","Kalyan, India",10 - 49 employees,"$1,000+"
