company_name,category,description,overall_rating,review_count,clients,notable_project,industries,location,company_size,min_project_size
CXR Agency,virtual-reality,"Launched in 2021, CXR is a digital strategy company. Their midsize team is based in Brooklyn, New York. Their team specializes in digital strategy, mobile & app marketing, AR/VR development, and corporate training.",4.7,(36 Reviews),HBO Max; Modelo; Dropbox; Cartier,"CXR (formerly CemtrexLabs) has helped a fashion designer and wholesaler migrate their website’s infrastructure over to a WordPress cloud-based hosting service. Moving forward, they’ll be in charge of the site’s redevelopment.","['Consumer products & services', 'eCommerce', 'Education', 'Financial services', 'Information technology', 'Media']","Brooklyn, NY",50 - 249 employees,"$10,000+"
Lucid Reality Labs,virtual-reality,"Lucid Reality Labs is the World’s leading Immersive Technology consulting, design and development company, with the primary focus on creating immersive XR trainings and simulations for Healthcare, MedTech, Pharma, Aerospace and Defense. Founded in 2016 the company has a team of around 50 diversely skilled professionals. Lucid Reality Labs is headquartered in Miami, FL. ",5.0,(27 Reviews),Medtronic; SHL Medical; Medasense; Werfen,"Lucid Reality Labs with Medtronic created an interactive and immersive McGRATH™ MAC VR Intubation Simulation experience, to demonstrate the product and to train practitioners and medical students remotely and safely. It educated participants on how to perform an intubation procedure with a variety of patients and the complexity of intubation scenarios.","['Education', 'Medical']","Miami, FL",10 - 49 employees,"$25,000+"
Treeview,virtual-reality,"Treeview is a boutique AR/VR shop that offers development services for startups. Founded in 2016, they have +5 years of experience building AR/VR software and more than 30 happy clients. They are located in Montevideo, Uruguay and they have about 11 team members. Their services include AR/VR development, 3D Design, and UI/UX Development.",5.0,(11 Reviews),Think Digital; ULTA Beauty; XR Medical Solutions Group; VisionWEAR,Treeview provides AR/VR development for a VR equipment manufacturer. They've built a VR dyslexia diagnosis test and developed an AR technology to take measurements with a virtual spectacle try-on system.,"['Business services', 'Consumer products & services', 'Education', 'Medical', 'Energy & natural resources']","Montevideo, Uruguay",10 - 49 employees,"$25,000+"
NEXT/NOW,virtual-reality,"NEXT/NOW is a Chicago-based creative technology agency founded in 2011. The team of around 20 pride themselves on creating digital brand experiences for physical spaces through AR/VR development, marketing services, and custom software development. ",4.9,(13 Reviews),Intel; Under Armour; Samsung; Adidas,NEXT/NOW created a photo booth incorporating green screen technology for a company’s 100th anniversary. The solution also included a website and large-scale LED screen to host and display an art competition.,"['Advertising & marketing', 'Arts, entertainment & music', 'Automotive', 'Consumer products & services', 'Financial services', 'Medical', 'Hospitality & leisure', 'Energy & natural resources', 'Retail']","Chicago, IL",10 - 49 employees,"$50,000+"
tsukat,virtual-reality,"TSUKAT is a AR/VR firm based in Miami. Founded in 2017, their team of 30 serves clients in the advertising, entertainment, and real estate sectors. Services include iOS and Android development.",4.9,(13 Reviews),Koerber; Youmawo; Wiener Linien; Hauni,TSUKAT developed a VR treadmill for a fitness solution and integrated it with an online multiplayer server.,"['Advertising & marketing', 'Arts, entertainment & music', 'Education', 'Gaming', 'Medical', 'Manufacturing', 'Energy & natural resources', 'Real estate']","Miami, FL",50 - 249 employees,"$25,000+"
Born Studios,virtual-reality,"DxGreat is a digital experience company based in London with an office in Istanbul. The company, founded in 2017, has a team of less than ten that provides UX/UI design, web development, mobile app development, and e-commerce development services. DxGreat serves enterprise and smaller-sized companies in the consumer products & services, financial services, hospitality & leisure, IT, and e-commerce industries. ",5.0,(10 Reviews),Diageo; Mercedes Benz; Goodyear; Danone,DxGreat was tasked with redesigning the UI/UX of an IT and business consulting company's mobile application. They also integrated payment gateways into the app along with other requested features.,"['Automotive', 'Business services', 'Consumer products & services', 'Gaming', 'Information technology']","London, United Kingdom",10 - 49 employees,"$25,000+"
Groove Jones,virtual-reality,"Groove Jones is a mobile app, AR/VR, and custom software developer based in Dallas. Founded in 2015, this 10+ team of digital experts builds the interactive tools that give brands a competitive edge.",4.9,(21 Reviews),3M; 7 Eleven; AT&T; Amazon,Groove Jones has supported a professional sports team with various AR & VR needs. They’ve created four AR murals and run VR events where fans can experience playing a game with their favorite athletes.,"['Advertising & marketing', 'Automotive', 'Business services', 'Consumer products & services', 'Medical', 'Hospitality & leisure', 'Retail', 'Telecommunications']","Dallas, TX",10 - 49 employees,"$25,000+"
nomtek,virtual-reality,"nomtek is an award-winning app development company of more than 50 based in Wroclaw, Poland with offices in London and Berlin. Founded in 2009, their team has created numerous chart-topping apps and employs the lean startup methodology.",4.9,(35 Reviews),PONS; Ricardo.ch; Gebraucht.de; Switch & Co,nomtek provided development support for an NFT startup. The team was in charge of developing the client's backend systems and conducting QA testing. The main technology used was Ruby on Rails.,"['Arts, entertainment & music', 'Education', 'Gaming', 'Medical', 'Media', 'Retail', 'Supply Chain, Logistics, and Transport', 'Utilities']","Wrocław, Poland",50 - 249 employees,"$75,000+"
N-iX Game & VR Studio,virtual-reality,"N-iX Game & VR Studio is an AR/VR development company. Their midsize team is headquartered in L'viv, Ukraine; Kyiv, Ukraine; Malmö, Sweden and North Miami Beach, Florida. The firm provides AR/VR development and mobile app development. The firm was founded in 2012.",4.8,(6 Reviews),Paradox Interactive; Stormind Games; Deca Games; PIXO VR,"N-iX Game & VR Studio provided art direction and 3D animation for a video game company. They leveraged Photoshop, Unity, 3D Studio Max, and more advanced tools to deliver the game's visual identity and cyberpunk look. ","['Automotive', 'Education', 'Gaming', 'Information technology', 'Manufacturing', 'Retail']","L'viv, Ukraine",50 - 249 employees,"$100,000+"
Live Animations,virtual-reality,"Live Animations, founded in 2014, is an AR development company headquartered in Melville, N.Y. The company’s 43 employees specialize in AR/VR development, but also provide mobile app development, content marketing, and digital strategy services. They work with mid-market, enterprise, and small businesses in mainly the retail industry.
 ",5.0,(28 Reviews),Disney; 20th Century Fox; LG U+; Billa,A loyalty program provider needed to develop and implement virtual and augmented reality for a gamified project. They partnered with Live Animations after looking at their case studies.,"['Advertising & marketing', 'Education', 'Gaming', 'Retail', 'Telecommunications']","Kyiv, Ukraine",10 - 49 employees,"$10,000+"
CitrusBits,virtual-reality,,,,,,,"Pleasanton, CA",50 - 249 employees,Undisclosed
YORD STUDIO,virtual-reality,"YORD is a software agency based in Prague and founded in 2019 with more than 10 employees. They specialize in AR/VR and mobile app development solutions for clients ranging from startups to large firms in the fields of manufacturing, advertising, and automotive services.",5.0,(23 Reviews),Apple; Adidas; ŠKODA; Raiffeisenbank,"YORD STUDIO has designed and developed the UX/UI for a cross-metaverse retailer. They have built the platform, designed the UI/UX, developed the e-commerce section, and set up 3D models.","['Advertising & marketing', 'Automotive', 'Manufacturing', 'Real estate', 'Retail']","Prague, Czech Republic",10 - 49 employees,"$10,000+"
4Experience,virtual-reality,"4Experience is am AR/VR development company founded in 2015. Based in Bielsko-Biała, Poland, the team of 35 specializes in AR/VR development. They mainly serve small businesses and midmarket clients in the education, real estate, and gaming industries. ",5.0,(18 Reviews),Cisco; Ford; Omron; Walmart,4Experience developed a virtual reality training program for an HR consulting firm. The team used Unity for the development. They also performed QA testing.,"['Advertising & marketing', 'Education', 'Gaming', 'Medical', 'Manufacturing', 'Real estate', 'Retail']","Bielsko-Biała, Poland",50 - 249 employees,"$25,000+"
Bit Space Development Ltd.,virtual-reality,"Bit Space Development Ltd. is an interactive digital media studio headquartered in Winnipeg, Canada. The company, founded in 2015, specializes in AR/VR development, but also provide other services including custom software development, and IT strategy consulting. Their team of 14 people works with small, mid-market, and enterprise companies in mainly the utilities, manufacturing, and education industries. 
 ",4.9,(18 Reviews),Kohler Co.; IBEW Local 2085; IBEW Local 353; Canadian Fossil Discovery Centre,Bit Space Development Ltd. has built four virtual worlds for an academic institution. They created the VR experience based on the images and assets provided by the client about the Anishnaabemowin people.,"['Education', 'Manufacturing', 'Supply Chain, Logistics, and Transport', 'Utilities']","Winnipeg, Canada",10 - 49 employees,"$25,000+"
Onix-Systems,virtual-reality,"Onix-Systems is an outsourced IT service provider founded in 2000. They are based in Kirovohrad, Ukraine, with an office in Sausalito, Calif. The team of 133 specializes in web development, mobile app development, and UX/UI design. They mainly serve clients in the IT and advertising & marketing industries. ",4.9,(25 Reviews),misterb&b; Raiz Invest; ROI Genius; Alternative Spaces Inc,"Onix-Systems is the development partner of a fintech startup. They’ve helped them design and develop their banking app and admin portal using Java, Sprint Boot, Flutter, and Vue.js as the main technologies.","['Education', 'Financial services', 'Medical', 'Hospitality & leisure']","Kropyvnytskyi, Ukraine",250 - 999 employees,"$25,000+"
Saritasa,virtual-reality,"Saritasa is a full-source software development firm based in Newport Beach, Calif. With additional offices in New York City, Russia, and Vietnam. They were founded in 2005 and employ a team of about 90 who provide custom software, web, mobile, IoT, and AR/VR development for mostly mid-sized businesses.",4.8,(87 Reviews),iHeartMedia; BJ's Restaurant Brewhouse; TIPMed; Vance & Hines,"Saritasa has built customized software solutions for a transportation company. The team has developed dispatch, invoicing, and drive-tracking tools that allow the client to track loads on many fronts.","['Automotive', 'Business services', 'Financial services', 'Medical', 'Manufacturing', 'Real estate']","Newport Beach, CA",50 - 249 employees,"$25,000+"
Innowise Group,virtual-reality,"Innowise Group is a custom software development company based in Warsaw, Poland. With more than 1000 specialists on board and 600 projects completed, they use cutting-edge technologies to transform their client's businesses. They are experts in designing and developing tech solutions that will help your company enhance its processes and increase customer satisfaction, thanks to their 15+ years of experience and extensive expertise. They create custom software to fit your unique requirements in terms of timeline, budget, and use case. They handle every step of the development process, from product concept and development to testing, deployment, and support. In addition to building custom software, we also excel in UX/UI design, IT strategy consulting, and staff augmentation.",4.8,(40 Reviews),Terraces.io; Voka; Belyagdar; Instatsport,A digital healthcare company hired Innowise Group to provide mobile app development. They created a platform for respiratory conditions that analyzes inhalation flow and allows users to record symptom data.,"['Education', 'Financial services', 'Medical']","St. Petersburg, FL","1,000 - 9,999 employees","$5,000+"
iTechArt Group,virtual-reality,"Headquartered in New York, iTechArt is a custom software development company with additional offices in Marietta, Ga. and Iselin, N.J. Since 2002, iTechArt has helped startups and fast-growing tech companies fill in their talent gap and create robust web and mobile solutions that users love. To date, iTechArt’s talent pool includes 3500+ engineers with experience in all of the latest technologies.",4.9,(52 Reviews),ClassPass; ZEFR; Gain Capital (forex.com); Merkle,"iTechArt Group's engineers help a fintech firm with the development of their services. Some of their tasks include user onboarding, user account creation, tenant configuration management, and authentication.","['Education', 'Financial services', 'Gaming', 'Medical']","New York, NY","1,000 - 9,999 employees","$25,000+"
Program-Ace,virtual-reality,"Program-Ace is an innovation-oriented IT company founded in 1992. Based in Kharkiv, Ukraine, the team of 123 specializes in AR/VR development, mobile app development, and web development. They mainly serve small business and midmarket clients in the gaming, education, and IT industries. ",4.7,(38 Reviews),Unity; Epic Games; Wargaming; GSN Games,"Program-Ace is developing a volumetric visualization app for a visual intelligence SaaS platform. The team uses Unreal Engine, Git, C++, and a Cesium plug-in for the build and Pixel Streaming for delivery.","['Advertising & marketing', 'Education', 'Gambling', 'Gaming', 'Information technology', 'Manufacturing']","Nicosia, Cyprus",50 - 249 employees,"$75,000+"
CM&D,virtual-reality,"Chocolate Milk & Donuts is a full-service creative agency founded in 2016. Based in Austin, Texas, the team of 9 specializes in AR/VR development, video production, and advertising.",4.8,(6 Reviews),VW; Pepsi; Lloyd's Bank; Total,"CM&D produced a VR experience for a healthcare advertising company’s client. They filmed the project with a 360-degree view, stitched it together, developed the UI, then loaded it into VR headsets.","['Advertising & marketing', 'Arts, entertainment & music', 'Business services', 'Education', 'Government', 'Media']","Austin, TX",10 - 49 employees,"$10,000+"
Queppelin,virtual-reality,"Queppelin is an IT solutions company based in Jaipur, India, and founded in 2010. They also have an office in Gurgaon, India. Their team of more than 200 employees specializes in AR/VR, mobile app, custom software, and web development for midmarket and small business companies. They mostly work with companies in the media, real estate, arts, and telecommunications industries.",4.8,(28 Reviews),Facebook; Kimberly-Clark; Warner Bros; Reliance,"Hired to provide 3D modeling expertise, Queppelin has been an extension of a customer loyalty company's in-house team. Their work includes creating cartoons and 3D rigged models in Cinema4D.","['Arts, entertainment & music', 'Automotive', 'Financial services', 'Gaming', 'Information technology', 'Media', 'Real estate', 'Retail', 'Telecommunications']","New York, NY",250 - 999 employees,"$10,000+"
Digital Jalebi,virtual-reality,"Founded in 2012, DJ Interactive Solutions is an AR/VR development company. The agency provides AR/VR development, web development, ux/ui design, IoT development, and more and has a midsize team. The agency is headquartered in Noida, India.",4.6,(11 Reviews),,Digital Jalebi created an AR app for a development consultation firm. The platform aimed to showcase their customer-based event and how they overcame their challenges. ,"['Advertising & marketing', 'Arts, entertainment & music', 'Consumer products & services', 'Information technology', 'Media', 'Non-profit', 'Retail', 'Telecommunications']","Noida, India",50 - 249 employees,"$1,000+"
FFFACE.ME,virtual-reality,"Established in 2019, FFFACE.ME is an AR/VR development company. They are located in Kyiv, Ukraine and have a small team. Their services include AR/VR development, social media marketing, and other design.",5.0,(16 Reviews),"Pepsi, Puma, Visa, Meta, Viber, Ogilvy, Havas, Monobank, Depositphotos, Luxoptica, Anex, Lenovo, LG, Huawei, Skylum, Lyle&Scott, Bird, Avon, Maybelline, Wella, Beko, Ahmad, Borjomi, La Roche Pose, Pokermatch, Bosch, Porsche",FFFACE.ME created an Instagram filter for an ophthalmology clinic. The filter was used to promote the clinic by giving users free test coupons.,"['Advertising & marketing', 'Arts, entertainment & music', 'Automotive', 'Consumer products & services', 'eCommerce', 'Education', 'Financial services', 'Gambling', 'Gaming', 'Medical']","London, United Kingdom",10 - 49 employees,"$1,000+"
Suffescom Solutions Inc,virtual-reality,"Headquartered in India, Suffescom Solutions is an IT firm skilled in web design, web development, and e-commerce development. The team of more than 60 employees serves mostly small and mid-market businesses in the IT, real estate, and advertising and marketing industries.",4.8,(58 Reviews),Morgan Elliott; PC Doctor; Unimilk; LIndsey Reishman Real Estate,Suffescom Solutions Inc developed a service portal for a pest control company. They also helped customize the header and footer design and provided insights about the site's overall structure.,"['Automotive', 'eCommerce', 'Education', 'Financial services', 'Gaming', 'Medical', 'Information technology', 'Real estate', 'Supply Chain, Logistics, and Transport']","CALIFORNIA, CA",250 - 999 employees,"$10,000+"
Hyperlink InfoSystem,virtual-reality,"Founded in 2011, Hyperlink InfoSystem is a 250+ team of professionals dedicated to IT services, mobile app development, and ERP/SI consulting. Based in Ahmedabad, the company offers a range of digital solutions from offices in the UK, US, and Australia.",4.8,(126 Reviews),Discovery; Viacom; Disney; Cartoon Network.,"Hyperlink InfoSystem developed a customer- and technician-facing mobile app for an auto detailing franchise. The technology stack included React Native, and the app was built for both iOS and Android devices.","['Advertising & marketing', 'Business services', 'Consumer products & services', 'Gaming', 'Information technology', 'Real estate', 'Supply Chain, Logistics, and Transport']","Ahmedabad, India",250 - 999 employees,"$10,000+"
Techugo,virtual-reality,"Techugo is a mobile and web developer based in Noida, India with offices in the US and UAE. Established in 2015, their team of 120+ tackles iOS, Android, IoT (internet of things), and maintenance services.",4.8,(78 Reviews),BMF- India's #1 Foreign Exchange Marketplace; Trailblazer- Godfrey Philips sales got boosted by 8%; Dhanuka - Leading Fertilizer Manufacturing Fortune 200 Company; Airtel – Leading Telecom Service Provider,"Techugo is building an iOS app to connect musicians with their fans. Features include business management tools, admin panels that track user data, and the ability to create promotions directly tailored to fans.","['eCommerce', 'Education', 'Financial services', 'Medical', 'Media']","Noida, India",50 - 249 employees,"$10,000+"
Sector 5 Digital,virtual-reality,"Sector 5 Digital is a marketing and advertising company based in Fort Worth, Texas that was founded in 2014. Their team of around 25 employees provides a variety of services including event marketing and planning, AR/VR development, content marketing, and more. They mostly work with enterprise-level organizations in a large number of industries. ",4.8,(9 Reviews),,Sector 5 Digital has developed a VR-based training tool to teach cosmetic healthcare practitioners about facial anatomy. The app allows users to see the different layers of skin and tissue in the human face.,"['Advertising & marketing', 'Automotive', 'Consumer products & services', 'Government', 'Medical', 'Hospitality & leisure', 'Information technology', 'Manufacturing', 'Energy & natural resources', 'Supply Chain, Logistics, and Transport']","Fort Worth, TX",10 - 49 employees,"$25,000+"
Accelerance,virtual-reality,"Accelerance is a small IT strategy consulting company. The Redwood City, California-based firm was established in 2001. Their services include IT strategy consulting, custom software development, IT staff augmentation, enterprise app modernization, and more.",5.0,(27 Reviews),Acrowire; Find.com; MediaPro; AdRoll,"Accelerance has provided recruitment support to a cloud services company. They have been responsible for sourcing developers, QA, and scrum leaders to assist with a variety of development projects. ","['eCommerce', 'Education', 'Financial services', 'Medical', 'Information technology', 'Supply Chain, Logistics, and Transport']","Redwood City, CA",10 - 49 employees,"$100,000+"
VR Vision,virtual-reality,"VR Vision Inc. is an AR/VR developer based in Toronto. Founded in 2017, their team of about 20 employees provides AR/VR development, custom software development, application testing, and wearable app development services.",4.9,(17 Reviews),Toyota; Avangrid; Toronto Hydro; TC Energy,VR Vision introduced virtual reality services and infrastructure to an education program for enhanced learning and student engagement. The team worked with students to execute a VR urban visualization project.,"['Advertising & marketing', 'Automotive', 'Financial services', 'Government', 'Medical', 'Manufacturing', 'Energy & natural resources']","Toronto, Canada",10 - 49 employees,"$50,000+"
Empat,virtual-reality,"Empat is a digital agency based in Kyiv, Ukraine, and founded in 2013. With no more than 50 professionals, they provide e-commerce, web, and mobile app development solutions for clients in the industries of financial, dental, and healthcare services.",5.0,(60 Reviews),Porsche; Heinemann Duty-Free; Panasonic; Austrian Embassy,"Empat developed a website for an advertising and marketing company. They built the website from scratch, integrated animations, and provided ongoing support.","['eCommerce', 'Education', 'Financial services', 'Medical', 'Non-profit', 'Real estate', 'Retail']","Kyiv, Ukraine",50 - 249 employees,"$10,000+"
WE/AR Studio,virtual-reality,"WeAR Studio is an AR/VR development company founded in 2015. Based in Kyiv, Ukraine, the team of 35 specializes in AR/VR development. They mainly serve midmarket clients in industries such as advertising & marketing, retail and education.",4.9,(28 Reviews),Pepsi Co; Intel; Telenor; Vodafone,"WE/AR Studio developed a mobile application for Android and iOS for a tourism company. They implemented 3D models using Unity, synced animation with the voiceover, and set up geolocation limitations.","['Advertising & marketing', 'Automotive', 'Business services', 'Education', 'Manufacturing']","Los Angeles, CA",10 - 49 employees,"$10,000+"
Polyform Design Studio,virtual-reality,"UX design company and product design company Polyform Studio is based in Vancouver, Canada. They specialize in ux/ui design and product design and were founded in 2019.",5.0,(10 Reviews),,Polyform Studio was hired by a video conferencing platform to build out the design system for their product suite. This involved conducting research and building the UI foundation.,"['Consumer products & services', 'eCommerce', 'Information technology', 'Legal Cannabis', 'Retail']","Vancouver, Canada",50 - 249 employees,"$75,000+"
Corporation Pop,virtual-reality,"Based in Manchester, UK, Corporation Pop has been around for over a decade and is now an established part of the mobile and web development industry. The small team delivers powerful results to clients across several industries.",4.9,(16 Reviews),NHS; The Cream Group; Live Nation; BBC,Corporation Pop used their experience with Unity Engine software to redevelop a gaming platform that works to develop professional talent within the cybersecurity space.,"['Advertising & marketing', 'Arts, entertainment & music', 'Education', 'Medical', 'Media']","Manchester, United Kingdom",10 - 49 employees,"$25,000+"
Delta Reality,virtual-reality,"Founded in 2013, Delta Reality is a software development firm that offers custom software development, UX/UI design, app support, and AR/VR services to their clients. Their 50 employees are based out of Zagreb.",5.0,(9 Reviews),Microsoft; Linde; Samsung; Siemens,"Delta Reality helped a football club design, develop, and implement an AR solution to their product. The team managed and organized the timelines and processes. ","['Education', 'Gaming', 'Manufacturing', 'Energy & natural resources']","Zagreb, Croatia",10 - 49 employees,"$25,000+"
Nineva Studios,virtual-reality,"Nineva Studios is an AR/VR company founded in 2018 and located in Lviv, Ukraine. With a team of fewer than 10 individuals, they offer AR/VR development, custom software development, and mobile app development services.",4.8,(8 Reviews),Companies looking to develop a custom plugin/SDK for Unity/Unreal Engie; Companies/individuals looking to create games or other interactive experience in Unity/Unreal Engine,"Using C++, Nineva Studios produced a multi-platform indoor cycling app with Bluetooth connectivity capabilities. ","['Gaming', 'Information technology']","L'viv, Ukraine",10 - 49 employees,"$1,000+"
