company_name,category,description,overall_rating,review_count,clients,notable_project,industries,location,company_size,min_project_size
Elabhouse Software Design,virtual-reality,,,,,,"['Advertising & marketing', 'Consumer products & services', 'eCommerce', 'Education', 'Gaming', 'Government', 'Hospitality & leisure', 'Information technology', 'Real estate', 'Retail']","Dubai, United Arab Emirates",10 - 49 employees,"$1,000+"
The Glimpse Group,virtual-reality,,,,Chanel; Epic Games; Goodway; Boston Medical,,"['Advertising & marketing', 'Arts, entertainment & music', 'eCommerce', 'Education', 'Government', 'Medical', 'Non-profit', 'Real estate', 'Retail']","New York, NY",50 - 249 employees,Undisclosed
MIRABO JSC,virtual-reality,,,,,,,"Ha Noi , Vietnam",50 - 249 employees,Undisclosed
YUQIO Games and Apps,virtual-reality,"YUQIO LLC is a game, application, and web development agency founded in 2015. They are based in Kiev, Ukraine, with offices in London, United Kingdom and Frankfurt, Germany. The team of 16 specializes in AR/VR development, mobile app development, and custom software development. They mainly work with small businesses in the business services, financial services, and education industries. ",5.0,(7 Reviews),Cartoon Network; CBS; FOX; Blizzard,"YUQIO is currently designing and developing a therapeutic AR/VR video game. The team handles all the management, artwork, sound engineering, and programming needs as they build out the full product.","['Education', 'Gambling', 'Gaming', 'Real estate']","Kyiv, Ukraine",50 - 249 employees,"$1,000+"
Madhawk Games,virtual-reality,"Madhawk Games is a software house founded in 2012 with no more than 10 members. They offer custom software. AR/VR, and mobile app development solutions from their office in Jalandhar, India. They work with small and mid-market firms in the fields of gaming, IT, and more.",5.0,(1 Reviews),LipSync AR; Practical; Technakriti; DISCOVR So many clients have signed NDA with us,"Madhawk Games developed an Oculus Rift language learning solution, developing a Unity frontend and implementing existing artwork. They also contributed to an e-commerce solution development.","['Gaming', 'GPS, Navigation & GIS', 'Information technology']","Jalandhar, India",2 - 9 employees,"$10,000+"
Happyusers,virtual-reality,"Website development firm Happyusers was launched in 2014. The company focuses on web development, AR/VR development, and mobile app development and has a small team. The company is in L'viv, Ukraine.",4.9,(5 Reviews),,Happyusers partnered with an educational company to develop a website that allows children to learn robotics. The team is using WebGL and Three.js to develop the site.,"['Advertising & marketing', 'Information technology']","L'viv, Ukraine",10 - 49 employees,"$1,000+"
Dever,virtual-reality,,5.0,(2 Reviews),,"A textile company hired Dever to provide 3D and AR solutions for their product. The team designed and developed a mobile solution from scratch, while the client provided texts and pictures that they could use.","['Advertising & marketing', 'Arts, entertainment & music', 'eCommerce', 'Manufacturing']","Žiri, Slovenia",2 - 9 employees,"$10,000+"
INNOVATION HUB CONSULTING,virtual-reality,"INNOVATION HUB CONSULTING is a digital strategy and marketing firm based in Lima, Peru. Founded in 2015, their team of 100 serves clients in the banking, consumer goods, and healthcare sectors. Services include digital strategy and e-commerce development.",5.0,(3 Reviews),,"INNOVATION HUB CONSULTING consulted with the client on digital strategy for their website. Their team analyzed key metrics, including user engagement, bounce rate, and traffic of their competitors' sites.  ",,"San Isidro, Peru",50 - 249 employees,"$1,000+"
BR Softech PVT. LTD.,virtual-reality,"BR Softech is a software development company that was founded in 2010. They are headquartered in Jaipur, India and they have additional locations in Boston, Vancouver, and Hong Kong. The company consists of 244 employees and specializes in mobile app development, blockchain, and web development. Their client focus is enterprise businesses in the healthcare, entertainment, and business services industries.",4.6,(10 Reviews),Jaipur Zoo; Forest Department; Nahargarh Department; Gulfcybertech,BR Softech built an Android application to help a restaurant group launch a new location and generate loyal diners.,"['Business services', 'Gambling', 'Gaming', 'Government', 'Medical', 'Information technology', 'Media']","Jaipur, India",50 - 249 employees,"$5,000+"
Unanimous Studios,virtual-reality,"Unanimous Studios is a mobile apps and game development company based in Jaipur, India. Founded in 2010, the team of 32 specializes in mobile app development, UX/UI design, and AR/VR development. ",5.0,(3 Reviews),Canvas Print Co.; Eye Buy Direct,"Unanimous Studios designed icons, games, and technical frameworks for several iOS and Android gaming apps. They implemented SDKs and metrics tracking and worked on increasing attention and monetization.","['Consumer products & services', 'Gaming', 'Government', 'Utilities']","Jaipur, India",50 - 249 employees,"$5,000+"
Vibe VR,virtual-reality,"In Ottawa, Canada, Vibe VR is an AR/VR development company. The small firm was launched in 2021. Their services include AR/VR development.",5.0,(3 Reviews),University of Waterloo,An entertainment personality hired Vibe VR to produce a documentary featuring the roots of their character. The team was in charge of creating a poster and handling all pre- and post-production efforts.,,"Ottawa, Canada",2 - 9 employees,"$5,000+"
StudioKrew,virtual-reality,"Studio Krew is a digital creative agency founded in 2013. Based in New Dehli, India, the team of six specializes in mobile app development UX/UI design and IoT development. They primarily serve small business and enterprise level clients in the health care & medical, advertising & marketing, and education industries.",4.7,(3 Reviews),,"Studio Krew provided mobile application development services for Android and iOS. The apps’ features include booking options, event management, a user forum, and communication with other users.","['Advertising & marketing', 'Business services', 'Consumer products & services', 'Education', 'Gambling', 'Gaming', 'Medical', 'Media']","New Delhi, India",50 - 249 employees,"$1,000+"
Kvaba Interactive,virtual-reality,"Kvaba Interactive is a software agency founded in 2015 in Sofia, Bulgaria. Their team of no more than 50 specializes in web, custom software, and AR/VR development solutions for clients in the industries of advertising, gaming, and arts.",4.7,(3 Reviews),Volkswagen; Coca-Cola; Fanta; Viber,"Kvaba Interactive has helped the client produce interactive activations that use AR/VR technology. In one project, they developed a mobile app that corresponds to a large advent calendar set up at a mall.","['Advertising & marketing', 'Arts, entertainment & music', 'Education', 'Gaming']","Sofia, Bulgaria",10 - 49 employees,"$10,000+"
Netfork,virtual-reality,"Netfork is a Dover, Delaware-based mobile app development firm. The firm specializes in mobile app development, web development, custom software development, Artificial Intelligence, and more and is midsize.The firm was launched in 2019.",5.0,(5 Reviews),,Netfork was hired to develop and maintain a custom platform for a zero-waste packaging company and its customers. The team handled the creation of the MVP and is now tasked on ,,"Dover, DE",250 - 999 employees,"$10,000+"
Conovo Technologies,virtual-reality,"Conovo Technologies is a software house founded in 2019 in Slough, England. Their team of no more than 50 provides AR/VR, web, and mobile app development solutions to various clients, among other services.",5.0,(6 Reviews),Bluestreak Math; Pixel Dubai; Detail 360,Conovo Technologies developed an iOS and Android app from the ground up.,,"Slough, United Kingdom",50 - 249 employees,"$5,000+"
8th Wall,virtual-reality,"Located in Palo Alto, California, 8th Wall is a small [company:type]. The team specializes in [company:service_lines].",5.0,(1 Reviews),,8th Wall provides an AR platform for a spirits producer that the client can use to develop and release AR projects. The team hosts and manages the platform and has also provided advice on promoting AR.,,"Palo Alto, CA",10 - 49 employees,Undisclosed
Capitol Interactive,virtual-reality,"Capitol Interactive is an AR/VR development company in Washington, DC. In addition to AR/VR development, they also do video production and advertising. They have 5 people on their team and were founded in 2016.",5.0,(2 Reviews),US Postal Service; AARP; Discovery Communications; Washington Leadership Academy,"Capitol Interactive helped a digital agency create interactive experiences to market stamps for the USPS. In one project, they built a virtual stamp gallery that would allow for unique, individual engagements.",,"Washington, DC",2 - 9 employees,"$5,000+"
Elementals Studio,virtual-reality,"Elementals Studio is an AR/VR firm based in Singapore. Founded in 2010, their team of 30 serves clients in the automotive and transportations sectors. Services include web development and mobile app development.",4.8,(3 Reviews),Lenovo; Scooter Hut; Borneo Motors; Toyota Singapore,Elementals Studio designed and developed an AR-based mobile application to help an automotive company spark interest in an upcoming vehicle launch.,,"Singapore, Singapore",10 - 49 employees,"$10,000+"
Kampov Technology,virtual-reality,,,,,,"['Automotive', 'Education', 'Manufacturing', 'Energy & natural resources']","Kyiv, Ukraine",2 - 9 employees,"$5,000+"
MAMMOTH XR,virtual-reality,"MAMMOTH XR is an AR/VR development company headquartered in Calgary, Canada. The small team provides AR/VR development. The company was established in 2015.",5.0,(3 Reviews),,MAMMOTH XR served as a VR partner for an oil and gas company looking to improve upon their communication efforts. They visualized three different experiences to showcase activity in the oil sands.,,"Calgary, Canada",2 - 9 employees,"$25,000+"
Penn Studios,virtual-reality,"Video production company Penn Studios is in Mechanicsburg, Pennsylvania. The small team specializes in video production and AR/VR development and was launched in 2017.",5.0,(2 Reviews),,"A career and education institute hired Penn Studios to produce a series of videos showcasing the programs, classes, and students of the institution, with the goal of building positive awareness.",,"Mechanicsburg, PA",10 - 49 employees,"$1,000+"
The-Parallel,virtual-reality,"The-Parallel is a VR development company headquartered in London, England. They also have offices in Sydney, Australia; Karstula, Finland; Vilnius, Lithuania; and Minsk, Belarus. Founded in 2016, they have about 12 employees that serve clients in a wide range of sectors. Their services are specialized in VR development.",5.0,(3 Reviews),BI Group; Orda Invest; Promwad; Fenox,"The-Parallel developed a VR tool to enable interactive tours of houses and apartments, building several unique features into the application. Their team also integrated a CRM system into the platform.",,"London, United Kingdom",10 - 49 employees,"$5,000+"
itSilesia,virtual-reality,"ItSilesia is an AR/VR development company founded in 2007. They are in Gliwice, Poland and have a small team. The firm offers AR/VR development, custom software development, mobile app development, web development, and more.",4.9,(7 Reviews),,itSilesia supports the development of a VR training platform for a technology holding company. They have built a 3D model of the machine and made animations to reflect maintenance activities.,"['Advertising & marketing', 'Arts, entertainment & music', 'Automotive', 'Business services', 'Education', 'Gambling', 'Gaming', 'Medical', 'Media', 'Real estate']","Gliwice, Poland",10 - 49 employees,"$10,000+"
Clevbrain Technologies,virtual-reality,"Clevbrain Technologies is a mobile app development firm based in Ahmedabad, India. Founded in 2019, their team of 20 serves clients in the arts, education, and consumer products sector. Services include AR/VR development and web development.",5.0,(1 Reviews),,Clevbrain Technologies provides web design and support services for a design freelancer. Their work also includes app development work on an ongoing basis.,"['Arts, entertainment & music', 'Consumer products & services', 'Education', 'Financial services', 'Government', 'Medical', 'Information technology', 'Real estate', 'Retail']","Ahmedabad, India",10 - 49 employees,"$1,000+"
Wondour Inc.,virtual-reality,"Wondour is a branding agency. They are headquartered in Las Vegas, Nevada and have a small team. Their services include branding, marketing strategy, ux/ui design, architectural design, and more.",5.0,(3 Reviews),,"Wondour Inc. helped design a website and cloud-based software for a marketing company. They provided new ideas to promote the brand, increase leads, and enable sales staff to create presentations for customers.","['Arts, entertainment & music', 'Business services', 'eCommerce', 'Education', 'Financial services', 'Gambling', 'Gaming', 'Medical', 'Hospitality & leisure', 'Media']","Las Vegas, NV",10 - 49 employees,"$25,000+"
WBPRO LLC,virtual-reality,"WBPRO LLC is a mobile app development firm based in Orlando Fla. Founded in 2002, their team of 30 serves clients in the finance and education sectors. Services include custom software development and AR/VR development.",5.0,(1 Reviews),,"When their previous vendor failed to meet the requirements of the engagement, a software solutions company hired WBPRO to finish building their app. The team uses PHP and other databases.","['Business services', 'Education', 'Financial services', 'Information technology']","Orlando, FL",10 - 49 employees,"$10,000+"
NextThought Studios,virtual-reality,"Launched in 2011, NextThought Studios is a small video production agency. Their team specializes in video production and broadcast video. The agency is in Norman, Oklahoma.",4.9,(9 Reviews),Encyclopædia Britannica; TCI; Chegg; OpenStax,NextThought Studios created a short documentary for a digital agency's 20-year anniversary. The client wanted to document their growth for their former and current employees.,"['Advertising & marketing', 'Consumer products & services', 'Education', 'Government', 'Non-profit']","Norman, OK",10 - 49 employees,"$5,000+"
Virtual Lab,virtual-reality,"AR/VR development company Virtual Lab is headquartered in Boston, Massachusetts. They focus on AR/VR development, mobile app development, and product design and were founded in 2014.",4.9,(9 Reviews),,A social networking app hired Virtual Lab to develop a mobile platform. The team provided affordable fees and effective communication to complete the project.,"['Advertising & marketing', 'Arts, entertainment & music', 'Automotive', 'Consumer products & services', 'Gaming', 'Manufacturing', 'Real estate']","New York, NY",10 - 49 employees,"$10,000+"
App Mechanic,virtual-reality,"App Mechanic is an AR/VR development company that was founded in 2016. Their 18-person team is based in Mohali, India, and develops AR/VR solutions, mobile apps, and software for small and midmarket businesses in the gaming and IT industry. ",5.0,(6 Reviews),VR Walkcounter; Tokyo Contemporary Art Museum; Máquina de Sílabas,"App Mechanic codes an action game using Unreal Engine 4. Responsibilities include supporting the creation of the gaming environment, including 3D building models. ","['Gaming', 'Information technology']","Sahibzada Ajit Singh Nagar, India",10 - 49 employees,"$5,000+"
Awakeen Studio Pvt. Ltd.,virtual-reality,"Founded in 2019, Awakeen Studio is a AR/VR development company based in Ahmedabad, India. They primarily work with small and midmarket businesses from a variety of industries, including gaming. ",5.0,(1 Reviews),Pacha Alive; Tile Visualizer; Park Hunter Prehistoric,"Awakeen Studio Pvt. Ltd. developed an Android and iOS app, including the creation of augmented reality features. ","['Advertising & marketing', 'Arts, entertainment & music', 'Education', 'Gaming', 'Government', 'GPS, Navigation & GIS', 'Medical', 'Information technology', 'Manufacturing', 'Real estate']","Ahmedabad, India",10 - 49 employees,"$1,000+"
BidOn Games Studio,virtual-reality,"BidOn Games Studio is a software development company founded in 2012. Based in Cherkasy, Ukraine, the team of 36 specializes in mobile app development, AR/VR development, and other application development. ",5.0,(4 Reviews),Ghost Robot; Helen Doron; AppReal-VR; Engage,BidOn Games is developing a virtual reality game project using Unity. This graduate-level project is designed to show the potential of virtual reality in 3D environments. ,,"Cherkasy, Ukraine",10 - 49 employees,"$5,000+"
Zappar,virtual-reality,"Zappar is an AR/VR development company. They offer AR/VR development and were established in 2011. Their midsize team is based in London, United Kingdom.",,,,,,"London, United Kingdom",50 - 249 employees,Undisclosed
Quantumz,virtual-reality,"Quantumz is a small custom software development company. Established in 2020, the team offers custom software development, web development, mobile app development, AR/VR development, and more. The company is in Houston, Texas and Lahore, Pakistan.",5.0,(3 Reviews),,"Quantumz developed clinic management software for a healthcare company. They conducted an R&D and thoroughly collaborated to create a multifunctional solution using ASP.NET, Angular, and MS SQL technologies.","['Advertising & marketing', 'Arts, entertainment & music', 'Automotive', 'Dental', 'eCommerce', 'Education', 'Medical', 'Hospitality & leisure', 'Information technology', 'Real estate']","Houston, TX",10 - 49 employees,"$10,000+"
Juego Studios,virtual-reality,"Juego Studios is a gaming development company based in Bangalore, India with additional offices in Aventura, Fla., Dubai, UAE, Riyadh, Saudi Arabia, and London. Founded in 2011, they have a team of about 130 that works with gaming companies on mobile app development, AR/VR development, and enterprise app modernization.",4.6,(5 Reviews),United Airlines; Age of Gods; Amazon; Lazy Horse,Juego Studios has implemented a software upgrade to a gambling company’s OS. They’re also implementing code upgrades on an ongoing basis. ,"['Arts, entertainment & music', 'Gaming', 'Information technology', 'Media']","Bengaluru, India",50 - 249 employees,"$5,000+"
Sumeru Inc,virtual-reality,"Sumeru Inc is a full-service technology consultancy based in Los Angeles with more than 50 employees. Founded in 2002, they are experts in IT staff augmentation, web design, and social media marketing solutions for clients in the industries of financial services and nonprofit.",5.0,(22 Reviews),GAP; Marvell; McAfee; EY,A marketing company partnered with Sumeru Inc to help improve one of their client's websites. The goal is to upgrade its UX in order to improve its conversion rates.,"['Education', 'Financial services', 'Medical', 'Information technology', 'Non-profit', 'Retail']","Los Angeles, CA",50 - 249 employees,"$5,000+"
Creative Solutions,virtual-reality,"Creative Solutions is an augmented/virtual reality firm based in Nova Gorica, Slovenia. Founded in 2015, their team of 9 serves clients in the advertising, entertainment, and consumer products sectors. Services include mobile platform development.",5.0,(1 Reviews),Verizon; Specular Theory; Ledluks; Akeolab,Creative Solutions designed and developed an educational VR game from a specified framework. The solution has been delivered to a third-party customer.,"['Advertising & marketing', 'Arts, entertainment & music', 'Consumer products & services', 'Gambling', 'Gaming', 'Real estate']","Nova gorica, Slovenia",2 - 9 employees,"$5,000+"
Novaby,virtual-reality,"Novaby is a 3D/AR creative technologies studio based in Seattle and founded in 2018. Their team of more than 10 specializes in video production and AR/VR development solutions for clients in the fields of arts, advertising, and gaming.",5.0,(3 Reviews),TOTO USA; AirTerra; Swire Hotels; NapTime Studio,Novaby provided video production for an educational gaming company. The team created a promotional video for their new game.,"['Advertising & marketing', 'Arts, entertainment & music', 'eCommerce', 'Gaming']","Seattle, WA",10 - 49 employees,"$1,000+"
Imagine 4D,virtual-reality,"Imagine 4D is a software company based in Dorval, Canada with more than 10 members. They have offered custom software and AR/VR development solutions since their founding in 2015. They work with clients in the industries of real estate and energy.",5.0,(1 Reviews),,"Imagine 4D provides VR development services for an aerospace firm. They work on the firm’s nuclear power plant simulator project, where they develop an immersive 3D model integrated with other digital assets. ","['Energy & natural resources', 'Real estate']","Dorval, Canada",10 - 49 employees,"$100,000+"
8ninths,virtual-reality,"Founded in 2008, 8ninths is a Seattle-based augmented and virtual reality (AR/VR) solutions company. The team of 13 also provides mobile and web development, UI/UX design, and strategy.",4.8,(2 Reviews),NASA; Microsoft; Toyota; Holland America Line,8ninths worked on innovative branding and interactive experiences for Microsoft. The goal was to enhance user engagement and increase participation. The team worked on various projects as needed.,,"Seattle, WA",10 - 49 employees,Undisclosed
Kod Biro,virtual-reality,"Founded in 2013, Kod Biro is a software development agency that offers AR development, VR development, and mobile app development to their small business, mid-market, and enterprise clients in the advertising, marketing, arts and entertainment industries. Their 10 employees are based out of Zagreb.  ",5.0,(1 Reviews),Infodom Ltd.,"Kod Biro developed a multilingual mobile app for iOS an Android that allows boaters to report hazards to the harbormaster. While focusing on UX, they ensured outdoor usability.  ","['Advertising & marketing', 'Arts, entertainment & music']","Zagreb, Croatia",2 - 9 employees,"$5,000+"
Xnova 360,virtual-reality,,5.0,(2 Reviews),,Xnova 360 developed an AR-based filter for an advertising agency. The campaign was for a third-party client. The team developed the filter using an image of a crane and messages that the company provided. ,,"Bogotá, Colombia",2 - 9 employees,"$1,000+"
Phil Cohn,virtual-reality,"AR/VR development company Phil Cohn is based in Amsterdam, Netherlands. They focus on AR/VR development, graphic design, and social media marketing and were established in 2021.",5.0,(1 Reviews),,"To inspire the next generation of commercial AR creators, Phil Cohn writes technical tutorials that explore relevant challenging problems in Lens Studio, Snapchat's AR creation platform for a marketing company. ","['Arts, entertainment & music', 'Hospitality & leisure', 'Media']","Amsterdam, Netherlands",Freelancer employees,"$1,000+"
Extality,virtual-reality,"Extality is a web and software development company that has been offering AR and VR development, digital strategy, and mobile app development services to their enterprise and mid-market clients since 2018. Their 50 employees are based out of Encinitas, Calif., as well as their German offices in Köln and Cologne.",4.8,(5 Reviews),Magic Leap; CNN; Clark Construction; Phononic,Extality built an AR app for a semiconductor company to boost customer understanding of a new product. The finished product works on both iOS and Android.,,"Encinitas, CA",10 - 49 employees,"$10,000+"
New Discovery Agency,virtual-reality,"New Discovery Agency is a full-service digital agency headquartered in Cd. Juárez, Mexico. Founded in 2013, their team of approximately 3–6 employees primarily serves small businesses as well as some medium-sized clients. Their expansive service offering includes market research, web design, mobile app development, and web development.",4.8,(7 Reviews),Dufry Americas; 3sixtydutyfree; Johnson & Johnson; Vix,New Discovery Agency redesigned and structured a medical industry clothing manufacturer’s webpage to make it a successful online store. They also work on sales and social media efforts to earn more customers. ,"['Advertising & marketing', 'Arts, entertainment & music', 'Business services', 'eCommerce', 'Media']","Ciudad Juárez, Mexico",10 - 49 employees,"$1,000+"
Day 8 Labs,virtual-reality,"Day 8 Labs is an AR/VR development studio based in Boston. Founded in 2019, their team of fewer than 10 serves mostly enterprise and mid-sized businesses. They service a range of industries, including advertising and marketing, consumer products, and arts and media.",5.0,(3 Reviews),GSN; WGBH; MAYBELLINE; A&E TELEVISION,"Day 8 Labs develops custom digital activations for a blue-chip company product creation and manufacturing provider, delivering full-stack services in AR and other cutting-edge technology integrations.","['Advertising & marketing', 'Arts, entertainment & music', 'Consumer products & services', 'Education', 'Gaming', 'Retail']","Boston, MA",2 - 9 employees,"$10,000+"
Citrus Animations Inc,virtual-reality,"Midsize logo company Citrus Animations Inc, is located in San Jose, California. They offer logo, video production, and other design and were launched in 2012.",5.0,(1 Reviews),,Citrus Animations Inc created 3D animation videos for an educational institute. The team provided several videos for the client's social media channels and event pages.,"['Advertising & marketing', 'Business services', 'Consumer products & services', 'Media']","San Jose, CA",50 - 249 employees,"$10,000+"
